Handle,Title,Body (HTML),Vendor,Variant Price,Image Src
"mama-tried:-traditional-italian-cooking-for-the-screwed,-crude,-vegan,-and-tattooed","Mama Tried: Traditional Italian Cooking for the Screwed, Crude, Vegan, and Tattooed",,,Â£14.02,images/48192cbef9101060e3787d87d7c8d7d1.jpg
"lumberjanes,-vol.-2:-friendship-to-the-max-(lumberjanes-#5-8)","Lumberjanes, Vol. 2: Friendship to the Max (Lumberjanes #5-8)",,,Â£46.91,images/67f83a06f77d0ff3b06cb8ac04839422.jpg
"lumberjanes,-vol.-1:-beware-the-kitten-holy-(lumberjanes-#1-4)","Lumberjanes, Vol. 1: Beware the Kitten Holy (Lumberjanes #1-4)",,,Â£45.61,images/1c78cb31ededc4c662857cf65bd1619d.jpg
lumberjanes-vol.-3:-a-terrible-plan-(lumberjanes-#9-12),Lumberjanes Vol. 3: A Terrible Plan (Lumberjanes #9-12),,,Â£19.92,images/d69b7020c4210e12882ffca0428919a2.jpg
"layered:-baking,-building,-and-styling-spectacular-cakes","Layered: Baking, Building, and Styling Spectacular Cakes",,,Â£40.11,images/7306b860c7887dfb2a4b0083e2d6bf0d.jpg
judo:-seven-steps-to-black-belt-(an-introductory-guide-for-beginners),Judo: Seven Steps to Black Belt (an Introductory Guide for Beginners),,,Â£53.90,images/6d80608ef81001ad068df06fae44b7f8.jpg
join,Join,,,Â£35.67,images/df642e483f7ae23de6888c73f05e2014.jpg
in-the-country-we-love:-my-family-divided,In the Country We Love: My Family Divided,,,Â£22.00,images/1108a8d9ebccd9cd474012121c32a7f5.jpg
how-to-be-miserable:-40-strategies-you-already-use,How to Be Miserable: 40 Strategies You Already Use,,,Â£46.03,images/b09d7cb6aa8ae112dd457e588762d293.jpg
immunity:-how-elie-metchnikoff-changed-the-course-of-modern-medicine,Immunity: How Elie Metchnikoff Changed the Course of Modern Medicine,,,Â£57.36,images/e11e7e9514a123aee2415a1def85e638.jpg
"i-hate-fairyland,-vol.-1:-madly-ever-after-(i-hate-fairyland-(compilations)-#1-5)","I Hate Fairyland, Vol. 1: Madly Ever After (I Hate Fairyland (Compilations) #1-5)",,,Â£29.17,images/58e2097169e92a95d973da420ce7cc98.jpg
i-am-a-hero-omnibus-volume-1,I am a Hero Omnibus Volume 1,,,Â£54.63,images/f74db5141becf01083abc03c078f4922.jpg
her-backup-boyfriend-(the-sorensen-family-#1),Her Backup Boyfriend (The Sorensen Family #1),,,Â£33.97,images/41ee38c1d15f0139a3fb17b730dc4347.jpg
"giant-days,-vol.-2-(giant-days-#5-8)","Giant Days, Vol. 2 (Giant Days #5-8)",,,Â£22.11,images/d06ff4e3b9daf93b18bb21f1af19b5eb.jpg
forever-and-forever:-the-courtship-of-henry-longfellow-and-fanny-appleton,Forever and Forever: The Courtship of Henry Longfellow and Fanny Appleton,,,Â£29.69,images/f99e760b894d10c6e5ed578618918367.jpg
first-and-first-(five-boroughs-#3),First and First (Five Boroughs #3),,,Â£15.97,images/01a5285b17e7ec0e7e56294a8f8af28d.jpg
everydata:-the-misinformation-hidden-in-the-little-data-you-consume-every-day,Everydata: The Misinformation Hidden in the Little Data You Consume Every Day,,,Â£54.35,images/15972684c6f44f1be5e751d2e067cc16.jpg
fifty-shades-darker-(fifty-shades-#2),Fifty Shades Darker (Fifty Shades #2),,,Â£21.96,images/51862681bebec59be61f36f937c71fce.jpg
"don't-be-a-jerk:-and-other-practical-advice-from-dogen,-japan's-greatest-zen-master","Don't Be a Jerk: And Other Practical Advice from Dogen, Japan's Greatest Zen Master",,,Â£37.97,images/a79cac7aec3816fb754c1aedd2e82986.jpg
danganronpa-volume-1,Danganronpa Volume 1,,,Â£51.99,images/ce3942d9a10b6a17805136ace7c140fa.jpg
crown-of-midnight-(throne-of-glass-#2),Crown of Midnight (Throne of Glass #2),,,Â£43.29,images/b77d5e56daa3c22822abf1b8affbaef9.jpg
"codename-baboushka,-volume-1:-the-conclave-of-death","Codename Baboushka, Volume 1: The Conclave of Death",,,Â£36.72,images/eda54d1bfcdd39488013f7aae1eaf659.jpg
camp-midnight,Camp Midnight,,,Â£17.08,images/7a671ecf69cdcd2ea9ebe85da1b5585f.jpg
call-the-nurse:-true-stories-of-a-country-nurse-on-a-scottish-isle,Call the Nurse: True Stories of a Country Nurse on a Scottish Isle,,,Â£29.14,images/c5f2361aab546bc7f851cf93aec94ca3.jpg
bossypants,Bossypants,,,Â£49.46,images/943490007d42c0bc066efc899dafa472.jpg
burning,Burning,,,Â£28.81,images/9a2c2936fa9bd422be96805924e1411a.jpg
"bitch-planet,-vol.-1:-extraordinary-machine-(bitch-planet-(collected-editions))","Bitch Planet, Vol. 1: Extraordinary Machine (Bitch Planet (Collected Editions))",,,Â£37.92,images/9d1d68362670066b155936e37d61bc5b.jpg
algorithms-to-live-by:-the-computer-science-of-human-decisions,Algorithms to Live By: The Computer Science of Human Decisions,,,Â£30.81,images/28ea530a8b7955e422df64beaed7871a.jpg
"avatar:-the-last-airbender:-smoke-and-shadow,-part-3-(smoke-and-shadow-#3)","Avatar: The Last Airbender: Smoke and Shadow, Part 3 (Smoke and Shadow #3)",,,Â£28.09,images/9f25ffe4229a32d1368b3dfe248c3343.jpg
a-world-of-flavor:-your-gluten-free-passport,A World of Flavor: Your Gluten Free Passport,,,Â£42.95,images/0a6a53a8d37584a7906d2d5a0032f9c1.jpg
"a-piece-of-sky,-a-grain-of-rice:-a-memoir-in-four-meditations","A Piece of Sky, a Grain of Rice: A Memoir in Four Meditations",,,Â£56.76,images/096df83de35d408278fdc9108d930b5f.jpg
a-murder-in-time,A Murder in Time,,,Â£16.64,images/ccbd7a62caefd5a3a2e04dd7c2ff48fe.jpg
a-flight-of-arrows-(the-pathfinders-#2),A Flight of Arrows (The Pathfinders #2),,,Â£55.53,images/ec651ed66822d4b68938afa645b1ece2.jpg
a-fierce-and-subtle-poison,A Fierce and Subtle Poison,,,Â£28.13,images/acb65d6d11263ba98b0191b544f6c728.jpg
(un)qualified:-how-god-uses-broken-people-to-do-big-things,(Un)Qualified: How God Uses Broken People to Do Big Things,,,Â£54.00,images/e4f8c1c5954e09cb6c485d9db824eeb1.jpg
you-are-what-you-love:-the-spiritual-power-of-habit,You Are What You Love: The Spiritual Power of Habit,,,Â£21.87,images/529bf0d806ae2ab02bf23da4326b24c3.jpg
a-court-of-thorns-and-roses-(a-court-of-thorns-and-roses-#1),A Court of Thorns and Roses (A Court of Thorns and Roses #1),,,Â£52.37,images/0a78f89fc2dc78b700b494c3510e8920.jpg
tuesday-nights-in-1980,Tuesday Nights in 1980,,,Â£21.04,images/a3ade5edecde67449329c1ebb016c049.jpg
"william-shakespeare's-star-wars:-verily,-a-new-hope-(william-shakespeare's-star-wars-#4)","William Shakespeare's Star Wars: Verily, A New Hope (William Shakespeare's Star Wars #4)",,,Â£43.30,images/027a1f131d94c38f9e785f5d85a109c7.jpg
throne-of-glass-(throne-of-glass-#1),Throne of Glass (Throne of Glass #1),,,Â£35.07,images/4e8d87d1cb5e876ddb50599a1d1b656e.jpg
tracing-numbers-on-a-train,Tracing Numbers on a Train,,,Â£41.60,images/0a0514153dac092aac76b097b495f908.jpg
thomas-jefferson-and-the-tripoli-pirates:-the-forgotten-war-that-changed-american-history,Thomas Jefferson and the Tripoli Pirates: The Forgotten War That Changed American History,,,Â£59.64,images/777988a85de2269905bd8c2070a3cf58.jpg
the-wedding-dress,The Wedding Dress,,,Â£24.12,images/293bd9cd6fe1f8c82d1688aefe6cc5f7.jpg
thirteen-reasons-why,Thirteen Reasons Why,,,Â£52.72,images/6d7b69b4edcdf5b6b075d6fa53bf74bc.jpg
the-white-cat-and-the-monk:-a-retelling-of-the-poem-âpangur-bã¡nâ,The White Cat and the Monk: A Retelling of the Poem âPangur BÃ¡nâ,,,Â£58.08,images/490e049133ee9f398e6a70f25c12e308.jpg
the-third-wave:-an-entrepreneurâs-vision-of-the-future,The Third Wave: An Entrepreneurâs Vision of the Future,,,Â£12.61,images/0f76b00ea914ced1822d8ac3480c485f.jpg
the-vacationers,The Vacationers,,,Â£42.15,images/34c988a76c3cd7c04566d3030d8e7331.jpg
the-stranger,The Stranger,,,Â£17.44,images/c81aea97de1daaa0081d96f8564c204c.jpg
the-secret-(the-secret-#1),The Secret (The Secret #1),,,Â£27.37,images/d37038f81b8ad0342346951271c31e58.jpg
the-shadow-hero-(the-shadow-hero),The Shadow Hero (The Shadow Hero),,,Â£33.14,images/c3d2356443efca9bcad78eba8d249fc1.jpg
the-project,The Project,,,Â£10.65,images/4c57c192057269132623f9c6b3f69559.jpg
the-psychopath-test:-a-journey-through-the-madness-industry,The Psychopath Test: A Journey Through the Madness Industry,,,Â£36.00,images/dd637b4e7cb403932e6a29397d877e4e.jpg
the-regional-office-is-under-attack!,The Regional Office Is Under Attack!,,,Â£51.36,images/d473f01f077b91ce04e345305a3fa217.jpg
the-omnivore's-dilemma:-a-natural-history-of-four-meals,The Omnivore's Dilemma: A Natural History of Four Meals,,,Â£38.21,images/3d9d46815a4be5e5e6f5e641d8268961.jpg
the-power-of-now:-a-guide-to-spiritual-enlightenment,The Power of Now: A Guide to Spiritual Enlightenment,,,Â£43.54,images/132a17f55f0048a2f2df748c9f5ce4e4.jpg
the-murder-of-roger-ackroyd-(hercule-poirot-#4),The Murder of Roger Ackroyd (Hercule Poirot #4),,,Â£44.10,images/8638ba095b3b32e0abdef170e7bc4fd6.jpg
the-mistake-(off-campus-#2),The Mistake (Off-Campus #2),,,Â£43.29,images/9549db6862283a388659611bda63b97b.jpg
the-nerdy-nummies-cookbook:-sweet-treats-for-the-geek-in-all-of-us,The Nerdy Nummies Cookbook: Sweet Treats for the Geek in All of Us,,,Â£37.34,images/4157492623f9552e3efdc858a19968f3.jpg
the-love-and-lemons-cookbook:-an-apple-to-zucchini-celebration-of-impromptu-cooking,The Love and Lemons Cookbook: An Apple-to-Zucchini Celebration of Impromptu Cooking,,,Â£37.60,images/88e70e44632c3ca306191007bc723806.jpg
the-matchmaker's-playbook-(wingmen-inc.-#1),The Matchmaker's Playbook (Wingmen Inc. #1),,,Â£55.85,images/e9e3736effeb4982324dd0e4e64b2e81.jpg
the-long-shadow-of-small-ghosts:-murder-and-memory-in-an-american-city,The Long Shadow of Small Ghosts: Murder and Memory in an American City,,,Â£10.97,images/2b50fa031b2411a94bc68de0bbdd96fb.jpg
the-kite-runner,The Kite Runner,,,Â£41.82,images/651e956a041bf4b91bfba1374f0f91e7.jpg
the-house-by-the-lake,The House by the Lake,,,Â£36.95,images/46a2c968bfccf1979cc5576085eec6dd.jpg
the-genius-of-birds,The Genius of Birds,,,Â£17.24,images/2e52982210cbc8dffe414cab72b52e38.jpg
the-glittering-court-(the-glittering-court-#1),The Glittering Court (The Glittering Court #1),,,Â£44.28,images/2f21c9ffd0962092ce337ecd1b338f5b.jpg
the-girl-on-the-train,The Girl on the Train,,,Â£55.02,images/19ed2156391eebbcd757a0d9f6d5860c.jpg
the-cookies-&-cups-cookbook:-125+-sweet-&-savory-recipes-reminding-you-to-always-eat-dessert-first,The Cookies & Cups Cookbook: 125+ sweet & savory recipes reminding you to Always Eat Dessert First,,,Â£41.25,images/81374b88e925ba998c4049abcf805196.jpg
the-bridge-to-consciousness:-i'm-writing-the-bridge-between-science-and-our-old-and-new-beliefs.,The Bridge to Consciousness: I'm Writing the Bridge Between Science and Our Old and New Beliefs.,,,Â£32.00,images/39c7bebcde5d9643ede71ac8ee87ee69.jpg
the-emerald-mystery,The Emerald Mystery,,,Â£23.15,images/bc1f79af87032748b75d12079f51c031.jpg
the-artist's-way:-a-spiritual-path-to-higher-creativity,The Artist's Way: A Spiritual Path to Higher Creativity,,,Â£38.49,images/3b414b6d0340a0cbbd05be0942ddaada.jpg
the-art-of-war,The Art of War,,,Â£33.34,images/611b527ab7ecef530e3040c85f6602c3.jpg
the-10%-entrepreneur:-live-your-startup-dream-without-quitting-your-day-job,The 10% Entrepreneur: Live Your Startup Dream Without Quitting Your Day Job,,,Â£27.55,images/504b1891508614ff9393563f69d66c95.jpg
the-argonauts,The Argonauts,,,Â£10.93,images/22d01c710471f94dabfa41083fa3cf4e.jpg
suddenly-in-love-(lake-haven-#1),Suddenly in Love (Lake Haven #1),,,Â£55.99,images/58bb81b052b6ad90adcd57e95da99a50.jpg
something-more-than-this,Something More Than This,,,Â£16.24,images/b8f9e0169c3811f9ed145c3824208de6.jpg
shoe-dog:-a-memoir-by-the-creator-of-nike,Shoe Dog: A Memoir by the Creator of NIKE,,,Â£23.99,images/fc21d144c7289e5b1cb133e01a925126.jpg
soft-apocalypse,Soft Apocalypse,,,Â£26.12,images/61ca5ab6bc514b9527af9f805fa03c31.jpg
so-you've-been-publicly-shamed,So You've Been Publicly Shamed,,,Â£12.23,images/9d150a1d5832bb9e3b82bbc1541912d6.jpg
"shobu-samurai,-project-aryoku-(#3)","Shobu Samurai, Project Aryoku (#3)",,,Â£29.06,images/f37f3173a97baeac6b6421c54a6df7b5.jpg
secrets-and-lace-(fatal-hearts-#1),Secrets and Lace (Fatal Hearts #1),,,Â£20.27,images/049dafcbbc11bb61bb94e8b16f343936.jpg
scarlett-epstein-hates-it-here,Scarlett Epstein Hates It Here,,,Â£43.55,images/7eba21a2ecaa4651e44f04a7cd808520.jpg
poems-that-make-grown-women-cry,Poems That Make Grown Women Cry,,,Â£14.19,images/18ac3f16b10a5fc47e603d93335e3f24.jpg
redeeming-love,Redeeming Love,,,Â£20.47,images/c974d74fa0bd1735c6ae172d40b1c077.jpg
romero-and-juliet:-a-tragic-tale-of-love-and-zombies,Romero and Juliet: A Tragic Tale of Love and Zombies,,,Â£36.94,images/21bc2104d32569a0dbbb81923480d749.jpg
poses-for-artists-volume-1---dynamic-and-sitting-poses:-an-essential-reference-for-figure-drawing-and-the-human-form,Poses for Artists Volume 1 - Dynamic and Sitting Poses: An Essential Reference for Figure Drawing and the Human Form,,,Â£41.06,images/a4108800f6337c5aa13b104b252d52b8.jpg
"nightingale,-sing","Nightingale, Sing",,,Â£38.28,images/97e65c8381cc80ba1107c3ce81c4878d.jpg
night-sky-with-exit-wounds,Night Sky with Exit Wounds,,,Â£41.05,images/ff48b0696fb97b7f7b5c6d15e372cb70.jpg
mrs.-houdini,Mrs. Houdini,,,Â£30.25,images/b445dbc81ca3aff1321a6bf0d0fa231d.jpg
modern-romance,Modern Romance,,,Â£28.26,images/78cb28a3e8804131e8e0c3f7b8deb2fc.jpg
little-red,Little Red,,,Â£13.47,images/636b836f5c3d67b9cda1948f5ca08694.jpg
miss-peregrineâs-home-for-peculiar-children-(miss-peregrineâs-peculiar-children-#1),Miss Peregrineâs Home for Peculiar Children (Miss Peregrineâs Peculiar Children #1),,,Â£10.76,images/1dae4577eb25fcec3f88e4cbb3fc726a.jpg
louisa:-the-extraordinary-life-of-mrs.-adams,Louisa: The Extraordinary Life of Mrs. Adams,,,Â£16.85,images/ec2a7df6fdafc7e6f97b6c6da7980584.jpg
library-of-souls-(miss-peregrineâs-peculiar-children-#3),Library of Souls (Miss Peregrineâs Peculiar Children #3),,,Â£48.56,images/797a5468a7d06aba28d1cc7342b1f2ba.jpg
large-print-heart-of-the-pride,Large Print Heart of the Pride,,,Â£19.15,images/5955e9e333301e3eeb3b9575c2ad3659.jpg
i-had-a-nice-time-and-other-lies...:-how-to-find-love-&-sh*t-like-that,I Had a Nice Time And Other Lies...: How to find love & sh*t like that,,,Â£57.36,images/60e9df360fec611b15a1bbb4c28aad22.jpg
grumbles,Grumbles,,,Â£22.16,images/207840aea0c8e2be66d998b80c6a59d3.jpg
hollow-city-(miss-peregrineâs-peculiar-children-#2),Hollow City (Miss Peregrineâs Peculiar Children #2),,,Â£42.98,images/4cfd83a011f60d38b140642a441ce01a.jpg
full-moon-over-noahâs-ark:-an-odyssey-to-mount-ararat-and-beyond,Full Moon over Noahâs Ark: An Odyssey to Mount Ararat and Beyond,,,Â£49.43,images/fe8af6ceec7718986380c0fde9b3b34f.jpg
frostbite-(vampire-academy-#2),Frostbite (Vampire Academy #2),,,Â£29.99,images/2a2d6ebcedeb7249a2a85fd1fbfd06e1.jpg
first-steps-for-new-christians-(print-edition),First Steps for New Christians (Print Edition),,,Â£29.00,images/c650e687398b368f4a16276f6d00144b.jpg
follow-you-home,Follow You Home,,,Â£21.36,images/bbc0bdad3ad7f390017ea66bb7019579.jpg
finders-keepers-(bill-hodges-trilogy-#2),Finders Keepers (Bill Hodges Trilogy #2),,,Â£53.53,images/76804e1881b630a110794fef5aad02cf.jpg
"fables,-vol.-1:-legends-in-exile-(fables-#1)","Fables, Vol. 1: Legends in Exile (Fables #1)",,,Â£41.62,images/51e472da0b7be65921345af6d4ca9e51.jpg
drive:-the-surprising-truth-about-what-motivates-us,Drive: The Surprising Truth About What Motivates Us,,,Â£34.95,images/e948a672efe721b408c8dd1f1f3ec529.jpg
done-rubbed-out-(reightman-&-bailey-#1),Done Rubbed Out (Reightman & Bailey #1),,,Â£37.72,images/4eaf0482e122cf9100b0fff61ea3441a.jpg
eureka-trivia-6.0,Eureka Trivia 6.0,,,Â£54.59,images/e821a2e8fe4431eb895e9d46fe68c32e.jpg
doing-it-over-(most-likely-to-#1),Doing It Over (Most Likely To #1),,,Â£35.61,images/4b91460323973e9e140626d00474d74c.jpg
"deliciously-ella-every-day:-quick-and-easy-recipes-for-gluten-free-snacks,-packed-lunches,-and-simple-meals","Deliciously Ella Every Day: Quick and Easy Recipes for Gluten-Free Snacks, Packed Lunches, and Simple Meals",,,Â£42.16,images/38c342d52a30a8eb38b34668e9777222.jpg
dark-notes,Dark Notes,,,Â£19.19,images/1c8807c42be085f3b061fe63f62a3c39.jpg
"daring-greatly:-how-the-courage-to-be-vulnerable-transforms-the-way-we-live,-love,-parent,-and-lead","Daring Greatly: How the Courage to Be Vulnerable Transforms the Way We Live, Love, Parent, and Lead",,,Â£19.43,images/38ea04e1e16ebef78fd2595771fe2287.jpg
close-to-you,Close to You,,,Â£49.46,images/94f4405dae04559ecdd92e62486623e3.jpg
chasing-heaven:-what-dying-taught-me-about-living,Chasing Heaven: What Dying Taught Me About Living,,,Â£37.80,images/87cd2aa5c4e38244ffcb17b84b0f6efd.jpg
becoming-wise:-an-inquiry-into-the-mystery-and-art-of-living,Becoming Wise: An Inquiry into the Mystery and Art of Living,,,Â£27.43,images/3365a493bba6856798437c3e341a1e5d.jpg
big-magic:-creative-living-beyond-fear,Big Magic: Creative Living Beyond Fear,,,Â£30.80,images/78a64cdef1ea38f3ddcc77f5e3fac5fd.jpg
beauty-restored-(riley-family-legacy-novellas-#3),Beauty Restored (Riley Family Legacy Novellas #3),,,Â£11.11,images/68e81c5a221dcd71516b5711641f83ed.jpg
batman:-the-long-halloween-(batman),Batman: The Long Halloween (Batman),,,Â£36.50,images/26a6c3227af69348c542bc4e094279a4.jpg
batman:-the-dark-knight-returns-(batman),Batman: The Dark Knight Returns (Batman),,,Â£15.38,images/1e381319aaf7cf69c27a5171520d53fe.jpg
ayumi's-violin,Ayumi's Violin,,,Â£15.48,images/4378757ed2632f2473e7455ae9717820.jpg
anonymous,Anonymous,,,Â£46.82,images/31070621fa42e300a9aab403293bad92.jpg
amy-meets-the-saints-and-sages,Amy Meets the Saints and Sages,,,Â£18.46,images/c36fd57aa9fc55ab3ea56b6e08b59c8d.jpg
amatus,Amatus,,,Â£50.54,images/30512adbb6cba367d3f48e09a888da3c.jpg
amid-the-chaos,Amid the Chaos,,,Â£36.58,images/8a94b2ba501119af0d3520b94daf8c20.jpg
agnostic:-a-spirited-manifesto,Agnostic: A Spirited Manifesto,,,Â£12.51,images/6603ceb9ac44fb012f8bf54383bc0165.jpg
zealot:-the-life-and-times-of-jesus-of-nazareth,Zealot: The Life and Times of Jesus of Nazareth,,,Â£24.70,images/21dab5c065cfcde1bad7ded16a753102.jpg
you-(you-#1),You (You #1),,,Â£43.61,images/f2f19169771a8a8e1a4b72f22e799de8.jpg
"wonder-woman:-earth-one,-volume-one-(wonder-woman:-earth-one-#1)","Wonder Woman: Earth One, Volume One (Wonder Woman: Earth One #1)",,,Â£37.34,images/b66a733a0fd2c0ed2cffaf5d2d9dd146.jpg
why-the-right-went-wrong:-conservatism--from-goldwater-to-the-tea-party-and-beyond,Why the Right Went Wrong: Conservatism--From Goldwater to the Tea Party and Beyond,,,Â£52.65,images/cd64ccda3382d62fea8167eaadd6c9a0.jpg
wild-swans,Wild Swans,,,Â£14.36,images/ad42a85570a887faf1b9e12715cf59bf.jpg
whole-lotta-creativity-going-on:-60-fun-and-unusual-exercises-to-awaken-and-strengthen-your-creativity,Whole Lotta Creativity Going On: 60 Fun and Unusual Exercises to Awaken and Strengthen Your Creativity,,,Â£38.20,images/e3d59328474571d53aad7d07144e2ef0.jpg
what's-it-like-in-space?:-stories-from-astronauts-who've-been-there,What's It Like in Space?: Stories from Astronauts Who've Been There,,,Â£19.60,images/966f1fe13d231041bb516c281a675646.jpg
"we-are-robin,-vol.-1:-the-vigilante-business-(we-are-robin-#1)","We Are Robin, Vol. 1: The Vigilante Business (We Are Robin #1)",,,Â£53.90,images/3e611e2228ffe66b05f202cd3da0359c.jpg
walt-disney's-alice-in-wonderland,Walt Disney's Alice in Wonderland,,,Â£12.96,images/0f65a1f2a3705c67b3d2a787ab3e8b99.jpg
v-for-vendetta-(v-for-vendetta-complete),V for Vendetta (V for Vendetta Complete),,,Â£37.10,images/9d3f79bdbfe9a9caea353627b6685699.jpg
until-friday-night-(the-field-party-#1),Until Friday Night (The Field Party #1),,,Â£46.31,images/e1249f72129bd4b788ffd0cdd7834c24.jpg
twenty-yawns,Twenty Yawns,,,Â£22.08,images/40d7f9433c2f23370659c925a45fdcad.jpg
"unbroken:-a-world-war-ii-story-of-survival,-resilience,-and-redemption","Unbroken: A World War II Story of Survival, Resilience, and Redemption",,,Â£45.95,images/e6956bac63c9e1e6df6dac4db3a0ec0d.jpg
this-is-where-it-ends,This Is Where It Ends,,,Â£27.12,images/8edc314a67ed5ddad7bd0a2f30ad3238.jpg
through-the-woods,Through the Woods,,,Â£25.38,images/ac07aa5cfd42e6192bb801a749263bba.jpg
the-year-of-magical-thinking,The Year of Magical Thinking,,,Â£43.04,images/062af372ae666a16fa7e67ced2d1187c.jpg
the-wright-brothers,The Wright Brothers,,,Â£56.80,images/51985c3a61a47b8de85239b9e3b2a938.jpg
the-white-queen-(the-cousins'-war-#1),The White Queen (The Cousins' War #1),,,Â£25.91,images/11400b5532ad710359584a68db50f33c.jpg
the-testament-of-mary,The Testament of Mary,,,Â£52.67,images/06a62270c0700ae3c537cf394cf145ee.jpg
the-wedding-pact-(the-o'malleys-#2),The Wedding Pact (The O'Malleys #2),,,Â£32.61,images/21539e305aa09ec40b36daa43db3f2fe.jpg
the-time-keeper,The Time Keeper,,,Â£27.88,images/37d108ff5b19028a52ddd73dba35d543.jpg
the-star-touched-queen,The Star-Touched Queen,,,Â£46.02,images/ac1a0546d9cdf6cd82ab7712a6c418df.jpg
the-songs-of-the-gods,The Songs of the Gods,,,Â£44.48,images/08add5c58ff717da1b00d5dda3f7c637.jpg
the-song-of-achilles,The Song of Achilles,,,Â£37.40,images/4e56783b21a3a5c73e32e59241a351ac.jpg
the-rosie-project-(don-tillman-#1),The Rosie Project (Don Tillman #1),,,Â£54.04,images/45db8e5d17ac3683cce97977d162dc94.jpg
the-power-of-habit:-why-we-do-what-we-do-in-life-and-business,The Power of Habit: Why We Do What We Do in Life and Business,,,Â£16.88,images/03beffe578a7839374f7060639ce914d.jpg
the-lucifer-effect:-understanding-how-good-people-turn-evil,The Lucifer Effect: Understanding How Good People Turn Evil,,,Â£10.40,images/4b2a574e8382dcac92d046d30d2c27fc.jpg
the-long-haul-(diary-of-a-wimpy-kid-#9),The Long Haul (Diary of a Wimpy Kid #9),,,Â£44.07,images/b1e6c747381261cd6e60ac9d350c4bab.jpg
the-marriage-of-opposites,The Marriage of Opposites,,,Â£28.08,images/338e196723f3fb10d5c6990fe54be61d.jpg
the-loney,The Loney,,,Â£23.40,images/84cc7f93a8c6c766a6297a23227e68e8.jpg
the-literature-book-(big-ideas-simply-explained),The Literature Book (Big Ideas Simply Explained),,,Â£17.43,images/b79552e4f08ebad6516f6ddefbb7bd92.jpg
the-immortal-life-of-henrietta-lacks,The Immortal Life of Henrietta Lacks,,,Â£40.67,images/924d855a0ad5774410b0bb7c71afa788.jpg
the-last-mile-(amos-decker-#2),The Last Mile (Amos Decker #2),,,Â£54.21,images/e6dcc8f75214eb14edc1ce09c98f3d71.jpg
the-hidden-oracle-(the-trials-of-apollo-#1),The Hidden Oracle (The Trials of Apollo #1),,,Â£52.26,images/7c550a26f03e12343d0c6b4474b3eb1e.jpg
the-help-yourself-cookbook-for-kids:-60-easy-plant-based-recipes-kids-can-make-to-stay-healthy-and-save-the-earth,The Help Yourself Cookbook for Kids: 60 Easy Plant-Based Recipes Kids Can Make to Stay Healthy and Save the Earth,,,Â£28.77,images/bceb609c54f7739682b319a27a5b9783.jpg
the-guilty-(will-robie-#4),The Guilty (Will Robie #4),,,Â£13.82,images/7ffdc9c4b7bf965990c59460da9b66b7.jpg
the-first-hostage-(j.b.-collins-#2),The First Hostage (J.B. Collins #2),,,Â£25.85,images/813e1d11126330de52d9368e78d116cc.jpg
the-dovekeepers,The Dovekeepers,,,Â£48.78,images/248641d1d03b4dbfe3a7db4e20552973.jpg
the-darkest-lie,The Darkest Lie,,,Â£35.35,images/3b6ae7b1d7736819f4f44605441e283e.jpg
the-bane-chronicles-(the-bane-chronicles-#1-11),The Bane Chronicles (The Bane Chronicles #1-11),,,Â£44.73,images/e9fed5b725a6badd26ef93175fdc248b.jpg
the-bad-ass-librarians-of-timbuktu:-and-their-race-to-save-the-worldâs-most-precious-manuscripts,The Bad-Ass Librarians of Timbuktu: And Their Race to Save the Worldâs Most Precious Manuscripts,,,Â£15.77,images/c4d78673f6228b246d5d547c29eaa58b.jpg
the-14th-colony-(cotton-malone-#11),The 14th Colony (Cotton Malone #11),,,Â£39.24,images/5b3e36ce7c82e9dd8b416a23531c0121.jpg
that-darkness-(gardiner-and-renner-#1),That Darkness (Gardiner and Renner #1),,,Â£13.92,images/23b81994234ac127d701db1531a08e48.jpg
take-me-with-you,Take Me with You,,,Â£45.21,images/bdad8933d15df7d7c6f3a16a9315048b.jpg
swell:-a-year-of-waves,Swell: A Year of Waves,,,Â£45.58,images/7da658ca2d3fce1a9958fb754a179ba8.jpg
tastes-like-fear-(di-marnie-rome-#3),Tastes Like Fear (DI Marnie Rome #3),,,Â£10.69,images/749bca168778cf35fdb2441a9d6b403f.jpg
still-life-with-bread-crumbs,Still Life with Bread Crumbs,,,Â£26.41,images/a3ebe1ca5df0d3ff3e3d2b8fb8b2a551.jpg
steve-jobs,Steve Jobs,,,Â£39.50,images/70a49dbcdbbdbc8b7264d254d8197ecd.jpg
superman-vol.-1:-before-truth-(superman-by-gene-luen-yang-#1),Superman Vol. 1: Before Truth (Superman by Gene Luen Yang #1),,,Â£11.89,images/3132ce8535ec612bf8588a5bc62998d4.jpg
sorting-the-beef-from-the-bull:-the-science-of-food-fraud-forensics,Sorting the Beef from the Bull: The Science of Food Fraud Forensics,,,Â£44.74,images/5da545b9d44464af8b3d0a9511a050ca.jpg
shtum,Shtum,,,Â£55.84,images/63623a0b014b1f26e49aa61786e6e708.jpg
"so-cute-it-hurts!!,-vol.-6-(so-cute-it-hurts!!-#6)","So Cute It Hurts!!, Vol. 6 (So Cute It Hurts!! #6)",,,Â£35.43,images/53ead08572cc44510da38edf559722d1.jpg
someone-like-you-(the-harrisons-#2),Someone Like You (The Harrisons #2),,,Â£52.79,images/03672d82cd257167775d88568d2cce38.jpg
see-america:-a-celebration-of-our-national-parks-&-treasured-sites,See America: A Celebration of Our National Parks & Treasured Sites,,,Â£48.87,images/c71a85dbf8c2dbc75cb271026618477c.jpg
salt.,salt.,,,Â£46.78,images/c9924f9637aef6d9fc8e165be62f69ee.jpg
robin-war,Robin War,,,Â£47.82,images/08e3fff11713d162620c920a2574e149.jpg
"red-hood/arsenal,-vol.-1:-open-for-business-(red-hood/arsenal-#1)","Red Hood/Arsenal, Vol. 1: Open for Business (Red Hood/Arsenal #1)",,,Â£25.48,images/7a2319e460168eff8d91828ff380849c.jpg
rain-fish,Rain Fish,,,Â£23.57,images/ea1f22fa3179f3f84fbadd24fe89a1fd.jpg
"overload:-how-to-unplug,-unwind,-and-unleash-yourself-from-the-pressure-of-stress","Overload: How to Unplug, Unwind, and Unleash Yourself from the Pressure of Stress",,,Â£52.15,images/7f6bfd0fc24b974b4d7721899e93aa2c.jpg
"quarter-life-poetry:-poems-for-the-young,-broke-and-hangry","Quarter Life Poetry: Poems for the Young, Broke and Hangry",,,Â£50.89,images/68922093080c377fa521ba64d8d372e1.jpg
