Handle,Title,Body (HTML),Vendor,Variant Price,Image Src
"far-&-away:-places-on-the-brink-of-change:-seven-continents,-twenty-five-years","Far & Away: Places on the Brink of Change: Seven Continents, Twenty-Five Years",,,Â£15.06,images/65c4530fe298242e8b64c9ab8dd0c2d6.jpg
buying-in:-the-secret-dialogue-between-what-we-buy-and-who-we-are,Buying In: The Secret Dialogue Between What We Buy and Who We Are,,,Â£37.80,images/db3686ef6b30490998c1b24dbdf730d8.jpg
abstract-city,Abstract City,,,Â£56.37,images/5f5e2741d6c84f05fdd5adf8ba0d5642.jpg
13-hours:-the-inside-account-of-what-really-happened-in-benghazi,13 Hours: The Inside Account of What Really Happened In Benghazi,,,Â£27.06,images/db8dda82c57fd0c2b466d40c04ed6075.jpg
"eaternity:-more-than-150-deliciously-easy-vegan-recipes-for-a-long,-healthy,-satisfied,-joyful-life","Eaternity: More than 150 Deliciously Easy Vegan Recipes for a Long, Healthy, Satisfied, Joyful Life",,,Â£51.75,images/8e93f7095bcb98006b620dae07ef5514.jpg
brain-on-fire:-my-month-of-madness,Brain on Fire: My Month of Madness,,,Â£49.32,images/032c97318d71f028d40ab6f5d2ae023f.jpg
the-diary-of-a-young-girl,The Diary of a Young Girl,,,Â£59.90,images/eb2622ca0a304963d3bac0efa1bad775.jpg
the-lonely-city:-adventures-in-the-art-of-being-alone,The Lonely City: Adventures in the Art of Being Alone,,,Â£33.26,images/79660d2683a90670aa014cae6e02b2dc.jpg
a-mother's-reckoning:-living-in-the-aftermath-of-tragedy,A Mother's Reckoning: Living in the Aftermath of Tragedy,,,Â£19.53,images/32861b2d37c7b8da7bbce3a86a27123b.jpg
"the-sleep-revolution:-transforming-your-life,-one-night-at-a-time","The Sleep Revolution: Transforming Your Life, One Night at a Time",,,Â£11.68,images/b76a8c5c12390d9259b6235115ebf024.jpg
snatched:-how-a-drug-queen-went-undercover-for-the-dea-and-was-kidnapped-by-colombian-guerillas,Snatched: How A Drug Queen Went Undercover for the DEA and Was Kidnapped By Colombian Guerillas,,,Â£21.21,images/17955609393fb4348e2321228d3e3e4f.jpg
"mother,-can-you-not?","Mother, Can You Not?",,,Â£16.89,images/88b464746c5882cc605827a0521ddcea.jpg
"10%-happier:-how-i-tamed-the-voice-in-my-head,-reduced-stress-without-losing-my-edge,-and-found-self-help-that-actually-works","10% Happier: How I Tamed the Voice in My Head, Reduced Stress Without Losing My Edge, and Found Self-Help That Actually Works",,,Â£24.57,images/dd8974991a279418738f38d5561979c4.jpg
furiously-happy:-a-funny-book-about-horrible-things,Furiously Happy: A Funny Book About Horrible Things,,,Â£41.46,images/284c3b0cbb254825f5bfd60e89d936af.jpg
"zero-to-one:-notes-on-startups,-or-how-to-build-the-future","Zero to One: Notes on Startups, or How to Build the Future",,,Â£34.06,images/f30001f2851f82c266e2faa77bcdd924.jpg
chernobyl-01:23:40:-the-incredible-true-story-of-the-world's-worst-nuclear-disaster,Chernobyl 01:23:40: The Incredible True Story of the World's Worst Nuclear Disaster,,,Â£35.92,images/584ac01e05ae76b1672f25a53384c617.jpg
why-not-me?,Why Not Me?,,,Â£17.76,images/6695cfb7ba5e0a6ef995300db6762fb6.jpg
"the-midnight-assassin:-panic,-scandal,-and-the-hunt-for-america's-first-serial-killer","The Midnight Assassin: Panic, Scandal, and the Hunt for America's First Serial Killer",,,Â£28.45,images/38ec5240eb37dfc9ebe54fa7584842ed.jpg
when-breath-becomes-air,When Breath Becomes Air,,,Â£39.36,images/269d1774be6dd9e649c4170fbc8d27eb.jpg
smarter-faster-better:-the-secrets-of-being-productive-in-life-and-business,Smarter Faster Better: The Secrets of Being Productive in Life and Business,,,Â£38.89,images/1665c94f1ec5580132a16c3bdfd0c421.jpg
man's-search-for-meaning,Man's Search for Meaning,,,Â£29.48,images/97dac3668fcca2cf5af4e1bb971af546.jpg
rising-strong,Rising Strong,,,Â£21.82,images/de5c4ea75d455748861ce2bc844fb198.jpg
"love-that-boy:-what-two-presidents,-eight-road-trips,-and-my-son-taught-me-about-a-parent's-expectations","Love That Boy: What Two Presidents, Eight Road Trips, and My Son Taught Me About a Parent's Expectations",,,Â£25.06,images/006e242a10f2e27b71edfd1ca8020318.jpg
living-forward:-a-proven-plan-to-stop-drifting-and-get-the-life-you-want,Living Forward: A Proven Plan to Stop Drifting and Get the Life You Want,,,Â£12.55,images/06bf33339562e138906eef6793ef53cd.jpg
i-will-find-you,I Will Find You,,,Â£44.21,images/58080dbe2c118867331f4ef932ca96c0.jpg
brazen:-the-courage-to-find-the-you-that's-been-hiding,Brazen: The Courage to Find the You That's Been Hiding,,,Â£19.22,images/4c5479ee2b9edd4b2f22b888d139b08f.jpg
"a-murder-over-a-girl:-justice,-gender,-junior-high","A Murder Over a Girl: Justice, Gender, Junior High",,,Â£13.20,images/98e30c1a7b9f2acd9e44d77e0a7dbff1.jpg
between-the-world-and-me,Between the World and Me,,,Â£56.91,images/355fa36362b722a241788d687fbc91af.jpg
being-mortal:-medicine-and-what-matters-in-the-end,Being Mortal: Medicine and What Matters in the End,,,Â£55.06,images/73ee61bd8724a36a83b691bb7b1a70b8.jpg
for-the-love:-fighting-for-grace-in-a-world-of-impossible-standards,For the Love: Fighting for Grace in a World of Impossible Standards,,,Â£45.13,images/a9f4d0f649833b477383263a8c5fb217.jpg
the-man-who-mistook-his-wife-for-a-hat-and-other-clinical-tales,The Man Who Mistook His Wife for a Hat and Other Clinical Tales,,,Â£59.45,images/d758851b2790471b1de776f49a997157.jpg
in-cold-blood,In Cold Blood,,,Â£49.98,images/7852b87face58f30b46004a4a4270f2d.jpg
finding-god-in-the-ruins:-how-god-redeems-pain,Finding God in the Ruins: How God Redeems Pain,,,Â£46.64,images/da0f0c01b1b9819fa7cb5e27a295351f.jpg
"girl,-interrupted","Girl, Interrupted",,,Â£42.14,images/9d6c5f23127bf494bc226daa02bc7daf.jpg
why-save-the-bankers?:-and-other-essays-on-our-economic-and-political-crisis,Why Save the Bankers?: And Other Essays on Our Economic and Political Crisis,,,Â£48.67,images/be98641184d97b2fad1bc6c90c571b80.jpg
talking-to-girls-about-duran-duran:-one-young-man's-quest-for-true-love-and-a-cooler-haircut,Talking to Girls About Duran Duran: One Young Man's Quest for True Love and a Cooler Haircut,,,Â£25.15,images/5d62099546e3889ad385b13c62bc8874.jpg
"data,-a-love-story:-how-i-gamed-online-dating-to-meet-my-match","Data, A Love Story: How I Gamed Online Dating to Meet My Match",,,Â£32.35,images/f2c56824a5aef38387350243762216eb.jpg
my-mother-was-nuts,My Mother Was Nuts,,,Â£31.63,images/6567e9868a3d1196f32c063c0f73ea01.jpg
the-jazz-of-physics:-the-secret-link-between-music-and-the-structure-of-the-universe,The Jazz of Physics: The Secret Link Between Music and the Structure of the Universe,,,Â£38.71,images/f3d18f7fa858139e133fe4809d3827b5.jpg
the-geography-of-bliss:-one-grump's-search-for-the-happiest-places-in-the-world,The Geography of Bliss: One Grump's Search for the Happiest Places in the World,,,Â£28.23,images/fd513e918a0b34fb08bc67d1d7065e40.jpg
the-gunning-of-america:-business-and-the-making-of-american-gun-culture,The Gunning of America: Business and the Making of American Gun Culture,,,Â£16.81,images/e223db017107fcccf532e5fe753f307d.jpg
we-the-people:-the-modern-day-figures-who-have-reshaped-and-affirmed-the-founding-fathers'-vision-of-america,We the People: The Modern-Day Figures Who Have Reshaped and Affirmed the Founding Fathers' Vision of America,,,Â£31.95,images/b945e870e5188ce6dabbf79ed98b10f1.jpg
god-is-not-great:-how-religion-poisons-everything,God Is Not Great: How Religion Poisons Everything,,,Â£27.80,images/ffb857154e4bc8af56f33d7277cb9939.jpg
very-good-lives:-the-fringe-benefits-of-failure-and-the-importance-of-imagination,Very Good Lives: The Fringe Benefits of Failure and the Importance of Imagination,,,Â£50.66,images/fd264a20852bbecf647475d968ac0409.jpg
under-the-banner-of-heaven:-a-story-of-violent-faith,Under the Banner of Heaven: A Story of Violent Faith,,,Â£30.00,images/0a44a38a50b7d61facccae446cf30630.jpg
"unstuffed:-decluttering-your-home,-mind,-and-soul","Unstuffed: Decluttering Your Home, Mind, and Soul",,,Â£58.09,images/682d1c7c8aa1010bd138203ae9d2d10b.jpg
"trespassing-across-america:-one-man's-epic,-never-done-before-(and-sort-of-illegal)-hike-across-the-heartland","Trespassing Across America: One Man's Epic, Never-Done-Before (and Sort of Illegal) Hike Across the Heartland",,,Â£53.51,images/fb6511ce55f5cf2ebf22a90655ad7c42.jpg
the-name-of-god-is-mercy,The Name of God is Mercy,,,Â£37.25,images/017c9fd993b4ebb5676213f6de1f96c5.jpg
stiff:-the-curious-lives-of-human-cadavers,Stiff: The Curious Lives of Human Cadavers,,,Â£36.74,images/0001685f344cae0e6921bc3f8256b54e.jpg
outliers:-the-story-of-success,Outliers: The Story of Success,,,Â£14.16,images/7c7f3a48d03cdbdd87c07482711b72f9.jpg
spilled-milk:-based-on-a-true-story,Spilled Milk: Based on a True Story,,,Â£49.51,images/2ea30e892e0060412f854b31a4e72e47.jpg
"rise-of-the-rocket-girls:-the-women-who-propelled-us,-from-missiles-to-the-moon-to-mars","Rise of the Rocket Girls: The Women Who Propelled Us, from Missiles to the Moon to Mars",,,Â£41.67,images/1c41d9cb63d3627fc60a1f3ba42da963.jpg
notes-from-a-small-island-(notes-from-a-small-island-#1),Notes from a Small Island (Notes From a Small Island #1),,,Â£40.17,images/8f40ba4f73d2c70e0ccc15d77dc3c220.jpg
night-(the-night-trilogy-#1),Night (The Night Trilogy #1),,,Â£13.51,images/b245b0b715de260634e66a05a024cc52.jpg
letter-to-a-christian-nation,Letter to a Christian Nation,,,Â£22.20,images/8821ea9cd21326e41e095619b822a4a8.jpg
"miracles-from-heaven:-a-little-girl,-her-journey-to-heaven,-and-her-amazing-story-of-healing","Miracles from Heaven: A Little Girl, Her Journey to Heaven, and Her Amazing Story of Healing",,,Â£57.83,images/60cda3c756f14ef6625b979cfeb230ea.jpg
let's-pretend-this-never-happened:-a-mostly-true-memoir,Let's Pretend This Never Happened: A Mostly True Memoir,,,Â£45.11,images/f58a15a50b2d70a4a8fd4fa6485a7009.jpg
it's-never-too-late-to-begin-again:-discovering-creativity-and-meaning-at-midlife-and-beyond,It's Never Too Late to Begin Again: Discovering Creativity and Meaning at Midlife and Beyond,,,Â£42.38,images/27f54466115767b767133ee034543cb5.jpg
into-the-wild,Into the Wild,,,Â£56.70,images/dec9168a8a3876b60feedb68aeb0225b.jpg
i-am-malala:-the-girl-who-stood-up-for-education-and-was-shot-by-the-taliban,I Am Malala: The Girl Who Stood Up for Education and Was Shot by the Taliban,,,Â£28.88,images/69077c48327b2702f44adc035fcc1ce4.jpg
"in-the-garden-of-beasts:-love,-terror,-and-an-american-family-in-hitler's-berlin","In the Garden of Beasts: Love, Terror, and an American Family in Hitler's Berlin",,,Â£28.85,images/b5a295c15ac586c6daa84e6e20f47b06.jpg
gratitude,Gratitude,,,Â£26.66,images/5673fea5d08ad840ade774146ce07b28.jpg
disrupted:-my-misadventure-in-the-start-up-bubble,Disrupted: My Misadventure in the Start-Up Bubble,,,Â£15.28,images/b72ee05aebe1a2563e30582a35bb5372.jpg
brave-enough,Brave Enough,,,Â£51.32,images/52f5c0cb27e1f26b2639ff3f78acf833.jpg
"born-to-run:-a-hidden-tribe,-superathletes,-and-the-greatest-race-the-world-has-never-seen","Born to Run: A Hidden Tribe, Superathletes, and the Greatest Race the World Has Never Seen",,,Â£27.35,images/3abdfc779aede13dbd2eefe34f91dbb1.jpg
blink:-the-power-of-thinking-without-thinking,Blink: The Power of Thinking Without Thinking,,,Â£21.74,images/41be12dcc78968882b11108acb79d1c7.jpg
black-flags:-the-rise-of-isis,Black Flags: The Rise of ISIS,,,Â£40.87,images/54a3916506dc5bd1a6ea2200a3d0b28f.jpg
"the-suffragettes-(little-black-classics,-#96)","The Suffragettes (Little Black Classics, #96)",,,Â£11.89,images/8f399ee98cb1a7c77525123b00d4b3e0.jpg
are-we-smart-enough-to-know-how-smart-animals-are?,Are We Smart Enough to Know How Smart Animals Are?,,,Â£56.58,images/18c1089811f55295b689bda892628fee.jpg
a-walk-in-the-woods:-rediscovering-america-on-the-appalachian-trail,A Walk in the Woods: Rediscovering America on the Appalachian Trail,,,Â£30.48,images/3951dc08d449aa692ce82eefb692254e.jpg
kindle-paperwhite-user's-guide,Kindle Paperwhite User's Guide,,,Â£34.00,images/0671e3db3053c0dc22122eda29d6734c.jpg
h-is-for-hawk,H is for Hawk,,,Â£57.42,images/140096c16c6e0b5d6df9d19f9493e8a5.jpg
travels-with-charley:-in-search-of-america,Travels with Charley: In Search of America,,,Â£57.82,images/3fc2d771fe5f12df5de998d99036a35a.jpg
the-tumor,The Tumor,,,Â£41.56,images/8a14b06317e794b3469e57d20270f80f.jpg
the-end-of-the-jesus-era-(an-investigation-#1),The End of the Jesus Era (An Investigation #1),,,Â£14.40,images/fa9db3f9dfc5a859c091d1262a56a89f.jpg
"eat,-pray,-love","Eat, Pray, Love",,,Â£51.32,images/5b827f00893b7119360e8a67d939e0b5.jpg
catastrophic-happiness:-finding-joy-in-childhood's-messy-years,Catastrophic Happiness: Finding Joy in Childhood's Messy Years,,,Â£37.35,images/3cb9c84d2a6a66f8bb6601d4f33deaa0.jpg
suzie-snowflake:-one-beautiful-flake-(a-self-esteem-story),Suzie Snowflake: One beautiful flake (a self-esteem story),,,Â£54.81,images/5913f74507084d0cd47e2b73fd806f9e.jpg
penny-maybe,Penny Maybe,,,Â£33.29,images/b14be641ab97a330891455a769d52fd3.jpg
"the-coming-woman:-a-novel-based-on-the-life-of-the-infamous-feminist,-victoria-woodhull","The Coming Woman: A Novel Based on the Life of the Infamous Feminist, Victoria Woodhull",,,Â£17.93,images/9736132a43b8e6e3989932218ef309ed.jpg
america's-cradle-of-quarterbacks:-western-pennsylvania's-football-factory-from-johnny-unitas-to-joe-montana,America's Cradle of Quarterbacks: Western Pennsylvania's Football Factory from Johnny Unitas to Joe Montana,,,Â£22.50,images/a32ab3b8c024c6c2b274a86b185e7585.jpg
maude-(1883-1993):she-grew-up-with-the-country,Maude (1883-1993):She Grew Up with the country,,,Â£18.02,images/65bfa3acc93b0e558a1c3de1b1164742.jpg
the-boys-in-the-boat:-nine-americans-and-their-epic-quest-for-gold-at-the-1936-berlin-olympics,The Boys in the Boat: Nine Americans and Their Epic Quest for Gold at the 1936 Berlin Olympics,,,Â£22.60,images/d12d26739b5369a6b5b3024e4d08f907.jpg
"starving-hearts-(triangular-trade-trilogy,-#1)","Starving Hearts (Triangular Trade Trilogy, #1)",,,Â£13.99,images/a07ed8f1c23f7b4baf7102722680bd30.jpg
aladdin-and-his-wonderful-lamp,Aladdin and His Wonderful Lamp,,,Â£53.13,images/a83c460fab82f35a37c0846729485547.jpg
"the-inefficiency-assassin:-time-management-tactics-for-working-smarter,-not-longer","The Inefficiency Assassin: Time Management Tactics for Working Smarter, Not Longer",,,Â£20.59,images/a5b8d2d5165a06fc762e8eaf8b04f98f.jpg
soul-reader,Soul Reader,,,Â£39.58,images/cc5e82c2205da748c6c19fbc1876586b.jpg
bossypants,Bossypants,,,Â£49.46,images/943490007d42c0bc066efc899dafa472.jpg
"a-piece-of-sky,-a-grain-of-rice:-a-memoir-in-four-meditations","A Piece of Sky, a Grain of Rice: A Memoir in Four Meditations",,,Â£56.76,images/096df83de35d408278fdc9108d930b5f.jpg
a-world-of-flavor:-your-gluten-free-passport,A World of Flavor: Your Gluten Free Passport,,,Â£42.95,images/0a6a53a8d37584a7906d2d5a0032f9c1.jpg
the-secret-(the-secret-#1),The Secret (The Secret #1),,,Â£27.37,images/d37038f81b8ad0342346951271c31e58.jpg
tracing-numbers-on-a-train,Tracing Numbers on a Train,,,Â£41.60,images/0a0514153dac092aac76b097b495f908.jpg
thirteen-reasons-why,Thirteen Reasons Why,,,Â£52.72,images/6d7b69b4edcdf5b6b075d6fa53bf74bc.jpg
the-psychopath-test:-a-journey-through-the-madness-industry,The Psychopath Test: A Journey Through the Madness Industry,,,Â£36.00,images/dd637b4e7cb403932e6a29397d877e4e.jpg
the-kite-runner,The Kite Runner,,,Â£41.82,images/651e956a041bf4b91bfba1374f0f91e7.jpg
the-girl-on-the-train,The Girl on the Train,,,Â£55.02,images/19ed2156391eebbcd757a0d9f6d5860c.jpg
the-bridge-to-consciousness:-i'm-writing-the-bridge-between-science-and-our-old-and-new-beliefs.,The Bridge to Consciousness: I'm Writing the Bridge Between Science and Our Old and New Beliefs.,,,Â£32.00,images/39c7bebcde5d9643ede71ac8ee87ee69.jpg
the-art-of-war,The Art of War,,,Â£33.34,images/611b527ab7ecef530e3040c85f6602c3.jpg
the-emerald-mystery,The Emerald Mystery,,,Â£23.15,images/bc1f79af87032748b75d12079f51c031.jpg
poses-for-artists-volume-1---dynamic-and-sitting-poses:-an-essential-reference-for-figure-drawing-and-the-human-form,Poses for Artists Volume 1 - Dynamic and Sitting Poses: An Essential Reference for Figure Drawing and the Human Form,,,Â£41.06,images/a4108800f6337c5aa13b104b252d52b8.jpg
secrets-and-lace-(fatal-hearts-#1),Secrets and Lace (Fatal Hearts #1),,,Â£20.27,images/049dafcbbc11bb61bb94e8b16f343936.jpg
romero-and-juliet:-a-tragic-tale-of-love-and-zombies,Romero and Juliet: A Tragic Tale of Love and Zombies,,,Â£36.94,images/21bc2104d32569a0dbbb81923480d749.jpg
miss-peregrineâs-home-for-peculiar-children-(miss-peregrineâs-peculiar-children-#1),Miss Peregrineâs Home for Peculiar Children (Miss Peregrineâs Peculiar Children #1),,,Â£10.76,images/1dae4577eb25fcec3f88e4cbb3fc726a.jpg
large-print-heart-of-the-pride,Large Print Heart of the Pride,,,Â£19.15,images/5955e9e333301e3eeb3b9575c2ad3659.jpg
first-steps-for-new-christians-(print-edition),First Steps for New Christians (Print Edition),,,Â£29.00,images/c650e687398b368f4a16276f6d00144b.jpg
grumbles,Grumbles,,,Â£22.16,images/207840aea0c8e2be66d998b80c6a59d3.jpg
drive:-the-surprising-truth-about-what-motivates-us,Drive: The Surprising Truth About What Motivates Us,,,Â£34.95,images/e948a672efe721b408c8dd1f1f3ec529.jpg
done-rubbed-out-(reightman-&-bailey-#1),Done Rubbed Out (Reightman & Bailey #1),,,Â£37.72,images/4eaf0482e122cf9100b0fff61ea3441a.jpg
eureka-trivia-6.0,Eureka Trivia 6.0,,,Â£54.59,images/e821a2e8fe4431eb895e9d46fe68c32e.jpg
beauty-restored-(riley-family-legacy-novellas-#3),Beauty Restored (Riley Family Legacy Novellas #3),,,Â£11.11,images/68e81c5a221dcd71516b5711641f83ed.jpg
ayumi's-violin,Ayumi's Violin,,,Â£15.48,images/4378757ed2632f2473e7455ae9717820.jpg
amy-meets-the-saints-and-sages,Amy Meets the Saints and Sages,,,Â£18.46,images/c36fd57aa9fc55ab3ea56b6e08b59c8d.jpg
amatus,Amatus,,,Â£50.54,images/30512adbb6cba367d3f48e09a888da3c.jpg
anonymous,Anonymous,,,Â£46.82,images/31070621fa42e300a9aab403293bad92.jpg
v-for-vendetta-(v-for-vendetta-complete),V for Vendetta (V for Vendetta Complete),,,Â£37.10,images/9d3f79bdbfe9a9caea353627b6685699.jpg
"unbroken:-a-world-war-ii-story-of-survival,-resilience,-and-redemption","Unbroken: A World War II Story of Survival, Resilience, and Redemption",,,Â£45.95,images/e6956bac63c9e1e6df6dac4db3a0ec0d.jpg
the-wright-brothers,The Wright Brothers,,,Â£56.80,images/51985c3a61a47b8de85239b9e3b2a938.jpg
the-songs-of-the-gods,The Songs of the Gods,,,Â£44.48,images/08add5c58ff717da1b00d5dda3f7c637.jpg
the-rosie-project-(don-tillman-#1),The Rosie Project (Don Tillman #1),,,Â£54.04,images/45db8e5d17ac3683cce97977d162dc94.jpg
steve-jobs,Steve Jobs,,,Â£39.50,images/70a49dbcdbbdbc8b7264d254d8197ecd.jpg
the-power-of-habit:-why-we-do-what-we-do-in-life-and-business,The Power of Habit: Why We Do What We Do in Life and Business,,,Â£16.88,images/03beffe578a7839374f7060639ce914d.jpg
luckiest-girl-alive,Luckiest Girl Alive,,,Â£49.83,images/2d6124f9d5328469e7ce5e4c04326ca5.jpg
"living-leadership-by-insight:-a-good-leader-achieves,-a-great-leader-builds-monuments","Living Leadership by Insight: A Good Leader Achieves, a Great Leader Builds Monuments",,,Â£46.91,images/b3201b03b2fd03915b1f85522be971af.jpg
"hush,-hush-(hush,-hush-#1)","Hush, Hush (Hush, Hush #1)",,,Â£47.02,images/0de97404e7bbd00d7aa6cd429b0de1da.jpg
lady-midnight-(the-dark-artifices-#1),Lady Midnight (The Dark Artifices #1),,,Â£16.28,images/bb80ecf408c9ecf1cc3652fa8947d245.jpg
greek-mythic-history,Greek Mythic History,,,Â£10.23,images/b04568c8b10a2aef00eaecafefac7ee0.jpg
every-last-word,Every Last Word,,,Â£46.47,images/c82df316ba150c761cd0b42b05930697.jpg
daily-fantasy-sports,Daily Fantasy Sports,,,Â£36.58,images/f6656d023fae1a6219bbe85219d59fd2.jpg
clockwork-angel-(the-infernal-devices-#1),Clockwork Angel (The Infernal Devices #1),,,Â£44.14,images/2f9ff4e4be85da448b02108171b54c3b.jpg
city-of-fallen-angels-(the-mortal-instruments-#4),City of Fallen Angels (The Mortal Instruments #4),,,Â£11.23,images/2146903b83225c6a74b42a0f19a54e5d.jpg
city-of-bones-(the-mortal-instruments-#1),City of Bones (The Mortal Instruments #1),,,Â£43.28,images/7e987ded586edb92faf57a0af78f1498.jpg
"carry-on,-warrior:-thoughts-on-life-unarmed","Carry On, Warrior: Thoughts on Life Unarmed",,,Â£31.85,images/d16b11b4c957d39bea33a43a96bf9e4c.jpg
city-of-ashes-(the-mortal-instruments-#2),City of Ashes (The Mortal Instruments #2),,,Â£47.27,images/f090a59e89a8d38bb1bcdc2137b18262.jpg
carrie,Carrie,,,Â£46.23,images/6b794e3dc0a32702b2132e2195f6c30f.jpg
angels-&-demons-(robert-langdon-#1),Angels & Demons (Robert Langdon #1),,,Â£51.48,images/c2fd7fed7aa38d095127d2ec62726b17.jpg
"the-three-searches,-meaning,-and-the-story","The Three Searches, Meaning, and the Story",,,Â£13.33,images/35ec45c2c5ed5eceb29fe5823ee9744e.jpg
how-to-speak-golf:-an-illustrated-guide-to-links-lingo,How to Speak Golf: An Illustrated Guide to Links Lingo,,,Â£58.32,images/4319716fa8ee2c315d07dc3c9c6762d2.jpg
eleanor-&-park,Eleanor & Park,,,Â£56.51,images/1558d3175d91e870644b8029bac93e13.jpg
adultery,Adultery,,,Â£20.88,images/f13bef3f1e05d0837bb46956a7a928f1.jpg
raspberry-pi-electronics-projects-for-the-evil-genius,Raspberry Pi Electronics Projects for the Evil Genius,,,Â£49.67,images/47a4a73d7e52e43ea0550ddd5d9ed034.jpg
troublemaker:-surviving-hollywood-and-scientology,Troublemaker: Surviving Hollywood and Scientology,,,Â£48.39,images/b3f9298d93e133db3e178d7c2d4130af.jpg
unlimited-intuition-now,Unlimited Intuition Now,,,Â£58.87,images/0a82c1dfd5b32349b8ce23bf6186553b.jpg
underlying-notes,Underlying Notes,,,Â£11.82,images/c176e12e5d560240086270fa6b762d5d.jpg
the-new-brand-you:-your-new-image-makes-the-sale-for-you,The New Brand You: Your New Image Makes the Sale for You,,,Â£44.05,images/74346ce51ac25a32c95ae9dc0d7ca515.jpg
"nano-what-now?-finding-your-editing-process,-revising-your-nanowrimo-book-and-building-a-writing-career-through-publishing-and-beyond","NaNo What Now? Finding your editing process, revising your NaNoWriMo book and building a writing career through publishing and beyond",,,Â£10.41,images/617bd5deaa5ea47ae717cb81c9a81ce8.jpg
modern-day-fables,Modern Day Fables,,,Â£47.44,images/53da160806b4854283b4477e5bf79522.jpg
the-flowers-lied,The Flowers Lied,,,Â£16.68,images/55c84e8714aa026c409ac63dc2a01434.jpg
the-martian-(the-martian-#1),The Martian (The Martian #1),,,Â£41.39,images/2e5841f29d7212ba8df7dc1323689318.jpg
the-unlikely-pilgrimage-of-harold-fry-(harold-fry-#1),The Unlikely Pilgrimage of Harold Fry (Harold Fry #1),,,Â£43.62,images/75e444aca5ac86166a55cc7e64f5724f.jpg
left-behind-(left-behind-#1),Left Behind (Left Behind #1),,,Â£40.72,images/11749e999f6ba7b9ef9408c624d1d71a.jpg
john-vassos:-industrial-design-for-modern-life,John Vassos: Industrial Design for Modern Life,,,Â£20.22,images/e8d47e80b92650728b837930cc578d63.jpg
i'll-give-you-the-sun,I'll Give You the Sun,,,Â£56.48,images/57a87a9b1ed0de0e6d1c048f575f327f.jpg
heaven-is-for-real:-a-little-boy's-astounding-story-of-his-trip-to-heaven-and-back,Heaven is for Real: A Little Boy's Astounding Story of His Trip to Heaven and Back,,,Â£52.86,images/301d6348c94fd869846aeadbeb15dad6.jpg
death-by-leisure:-a-cautionary-tale,Death by Leisure: A Cautionary Tale,,,Â£37.51,images/bb4ec136d9d9e9796e1591ed9adb0e66.jpg
ender's-game-(the-ender-quintet-#1),Ender's Game (The Ender Quintet #1),,,Â£43.64,images/4e0497a5aa3d442acef6a3e5d0d3447c.jpg
the-year-of-living-biblically:-one-man's-humble-quest-to-follow-the-bible-as-literally-as-possible,The Year of Living Biblically: One Man's Humble Quest to Follow the Bible as Literally as Possible,,,Â£34.72,images/e3b8b5a65135abbd9bdbd7a98baa1077.jpg
wildlife-of-new-york:-a-five-borough-coloring-book,Wildlife of New York: A Five-Borough Coloring Book,,,Â£22.14,images/3158b1c362c0d9646e1696d2ed6c1ae1.jpg
the-great-gatsby,The Great Gatsby,,,Â£36.05,images/21697f1564ae6776ca9280b17455c1b6.jpg
the-good-girl,The Good Girl,,,Â£49.03,images/00f23edcef10a5ece4e179f08271f19c.jpg
the-7-habits-of-highly-effective-people:-powerful-lessons-in-personal-change,The 7 Habits of Highly Effective People: Powerful Lessons in Personal Change,,,Â£33.17,images/083ad6c527d14b1621806d17ed6f13e9.jpg
steal-like-an-artist:-10-things-nobody-told-you-about-being-creative,Steal Like an Artist: 10 Things Nobody Told You About Being Creative,,,Â£20.90,images/6cea146ec9b4ee83061108782aef7d32.jpg
life-of-pi,Life of Pi,,,Â£13.22,images/2410311e3603f15637eccedd14ba1130.jpg
the-sound-of-love,The Sound Of Love,,,Â£57.84,images/90dfdcadfcff9cd39f6f933ac11c9241.jpg
the-perks-of-being-a-wallflower,The Perks of Being a Wallflower,,,Â£55.02,images/28219255776fb162c82ebac3cdddcf90.jpg
the-makings-of-a-fatherless-child,The Makings of a Fatherless Child,,,Â£31.58,images/2fb66b628ee51169b91cdfce8b68d929.jpg
the-hobbit-(middle-earth-universe),The Hobbit (Middle-Earth Universe),,,Â£17.80,images/1706d016ec39ba3caad03b49737fefc7.jpg
the-fellowship-of-the-ring-(the-lord-of-the-rings-#1),The Fellowship of the Ring (The Lord of the Rings #1),,,Â£10.27,images/5d9f339be8d98f597ad33eee239119d8.jpg
ship-leaves-harbor:-essays-on-travel-by-a-recovering-journeyman,Ship Leaves Harbor: Essays on Travel by a Recovering Journeyman,,,Â£30.60,images/1ed2c2f8f406ed7ed90a58f73d4f1058.jpg
what-if?:-serious-scientific-answers-to-absurd-hypothetical-questions,What If?: Serious Scientific Answers to Absurd Hypothetical Questions,,,Â£53.68,images/1f5a1bea2bd3e38dc105a7fe33a08826.jpg
musicophilia:-tales-of-music-and-the-brain,Musicophilia: Tales of Music and the Brain,,,Â£46.58,images/efe7be2e15323d5bee36c37e953b1cad.jpg
the-fault-in-our-stars,The Fault in Our Stars,,,Â£47.22,images/4f96ae30d8aefab78b9c8005197eb85f.jpg
the-dream-thieves-(the-raven-cycle-#2),The Dream Thieves (The Raven Cycle #2),,,Â£34.50,images/771a0d24c0ed726761a4ad4a4327e7d8.jpg
