Handle,Title,Body (HTML),Vendor,Variant Price,Image Src
the-passion-of-dolssa,The Passion of Dolssa,,,Â£28.32,images/b35975c0df26c40964028a8ccabc9a91.jpg
the-hunger-games-(the-hunger-games-#1),The Hunger Games (The Hunger Games #1),,,Â£29.85,images/4e9de73d08f8c0b1b6ea859a93f1aa31.jpg
the-hound-of-the-baskervilles-(sherlock-holmes-#5),The Hound of the Baskervilles (Sherlock Holmes #5),,,Â£14.82,images/9dfe2a73c6a1a1c09927c904de641ebf.jpg
the-gunning-of-america:-business-and-the-making-of-american-gun-culture,The Gunning of America: Business and the Making of American Gun Culture,,,Â£16.81,images/e223db017107fcccf532e5fe753f307d.jpg
the-geography-of-bliss:-one-grump's-search-for-the-happiest-places-in-the-world,The Geography of Bliss: One Grump's Search for the Happiest Places in the World,,,Â£28.23,images/fd513e918a0b34fb08bc67d1d7065e40.jpg
"the-demon-prince-of-momochi-house,-vol.-4-(the-demon-prince-of-momochi-house-#4)","The Demon Prince of Momochi House, Vol. 4 (The Demon Prince of Momochi House #4)",,,Â£27.88,images/20995345e7a87cdfb4503283ae991e84.jpg
the-demonists-(demonist-#1),The Demonists (Demonist #1),,,Â£52.11,images/bef8aac75369fc2211515cd4c76d3518.jpg
the-beast-(black-dagger-brotherhood-#14),The Beast (Black Dagger Brotherhood #14),,,Â£46.08,images/d4761761d26eb7fe1ba0a9480913a8ca.jpg
the-bone-hunters-(lexy-vaughan-&-steven-macaulay-#2),The Bone Hunters (Lexy Vaughan & Steven Macaulay #2),,,Â£59.71,images/8d1f11673fbe46f47f27b9a4c8efbf8a.jpg
some-women,Some Women,,,Â£13.73,images/2f710e4c53d98e47b73e4d34702a6751.jpg
shopaholic-ties-the-knot-(shopaholic-#3),Shopaholic Ties the Knot (Shopaholic #3),,,Â£48.39,images/d0f8f438caa5e7adc1c727da4f06ca64.jpg
paper-and-fire-(the-great-library-#2),Paper and Fire (The Great Library #2),,,Â£49.45,images/b63bd741fc6ada1e60a33db14bde0277.jpg
outlander-(outlander-#1),Outlander (Outlander #1),,,Â£19.67,images/2e3f900dfa0d70799f009f1c07f54697.jpg
"orchestra-of-exiles:-the-story-of-bronislaw-huberman,-the-israel-philharmonic,-and-the-one-thousand-jews-he-saved-from-nazi-horrors","Orchestra of Exiles: The Story of Bronislaw Huberman, the Israel Philharmonic, and the One Thousand Jews He Saved from Nazi Horrors",,,Â£12.36,images/b59425287ce6b186715fa7b01054c2bf.jpg
night-shift-(night-shift-#1-20),Night Shift (Night Shift #1-20),,,Â£12.75,images/b8843e0c3fbadb1682b095c99eda7f7a.jpg
needful-things,Needful Things,,,Â£47.51,images/d2d818d6654086560072fe1d42189636.jpg
no-one-here-gets-out-alive,No One Here Gets Out Alive,,,Â£20.02,images/8e9be254974e64a8a3d365a1571e3ec2.jpg
mockingjay-(the-hunger-games-#3),Mockingjay (The Hunger Games #3),,,Â£20.44,images/425a156d129df73861380d9fe49c1533.jpg
misery,Misery,,,Â£34.79,images/ccfb8bb0f63377a67fb0a39d513f6cab.jpg
little-women-(little-women-#1),Little Women (Little Women #1),,,Â£28.07,images/55a942b0c092c40bdbb6a1f1be340984.jpg
it,It,,,Â£25.01,images/f9409b5717cc44f29aa444d85ad26bdc.jpg
harry-potter-and-the-prisoner-of-azkaban-(harry-potter-#3),Harry Potter and the Prisoner of Azkaban (Harry Potter #3),,,Â£24.17,images/2793d4ce3d27cdcdb7a0961bc218b25f.jpg
harry-potter-and-the-sorcerer's-stone-(harry-potter-#1),Harry Potter and the Sorcerer's Stone (Harry Potter #1),,,Â£13.90,images/e73ff548ede8f14e62854878d86a604f.jpg
harry-potter-and-the-order-of-the-phoenix-(harry-potter-#5),Harry Potter and the Order of the Phoenix (Harry Potter #5),,,Â£31.63,images/ca565814dfe2d9f73d3d6b1ad7265984.jpg
harry-potter-and-the-half-blood-prince-(harry-potter-#6),Harry Potter and the Half-Blood Prince (Harry Potter #6),,,Â£48.75,images/06ee91950f111a29d18bccb0c3418fb4.jpg
harry-potter-and-the-chamber-of-secrets-(harry-potter-#2),Harry Potter and the Chamber of Secrets (Harry Potter #2),,,Â£14.74,images/9e3c81f9694c5832a24bf590c2a0b610.jpg
gone-with-the-wind,Gone with the Wind,,,Â£32.49,images/acee20cff19be38cc3efc5e9b50afae4.jpg
god-is-not-great:-how-religion-poisons-everything,God Is Not Great: How Religion Poisons Everything,,,Â£27.80,images/ffb857154e4bc8af56f33d7277cb9939.jpg
girl-with-a-pearl-earring,Girl With a Pearl Earring,,,Â£26.77,images/b15ec9da5c7b28e2d11347dd2e8c20e5.jpg
"fruits-basket,-vol.-4-(fruits-basket-#4)","Fruits Basket, Vol. 4 (Fruits Basket #4)",,,Â£50.44,images/770bf7bcb38eaacc6a9392dd0b7af1e4.jpg
confessions-of-a-shopaholic-(shopaholic-#1),Confessions of a Shopaholic (Shopaholic #1),,,Â£48.94,images/0288939291a11611aacb27925d3c2d19.jpg
dark-lover-(black-dagger-brotherhood-#1),Dark Lover (Black Dagger Brotherhood #1),,,Â£12.87,images/d8bdea8d4e7db9af8e0cb1b36db448d2.jpg
far-from-true-(promise-falls-trilogy-#2),Far From True (Promise Falls Trilogy #2),,,Â£34.93,images/9caacda3ff43984447ee22712e7e9ca9.jpg
changing-the-game-(play-by-play-#2),Changing the Game (Play by Play #2),,,Â£13.38,images/7a6a89af2f591d86df6f7c65649463db.jpg
candide,Candide,,,Â£58.63,images/e77d917c495e649216225bd47e006482.jpg
can-you-keep-a-secret?,Can You Keep a Secret?,,,Â£21.94,images/e124fe015a3ffa6857eb35c39e89cd61.jpg
atlas-shrugged,Atlas Shrugged,,,Â£26.58,images/9d3c5430a627260e4a8c9ca02c8a8924.jpg
animal-farm,Animal Farm,,,Â£57.22,images/73b9d68a89e6d037f1afdc70f96bad09.jpg
a-new-earth:-awakening-to-your-life's-purpose,A New Earth: Awakening to Your Life's Purpose,,,Â£55.65,images/131bca3895aa2892f400020cd939cd42.jpg
a-walk-to-remember,A Walk to Remember,,,Â£56.43,images/fea9278c15f5ad41f5d478196cf4132d.jpg
'salem's-lot,'Salem's Lot,,,Â£49.56,images/d35568710e773adf06a0bc756a99f66d.jpg
"a-history-of-god:-the-4,000-year-quest-of-judaism,-christianity,-and-islam","A History of God: The 4,000-Year Quest of Judaism, Christianity, and Islam",,,Â£27.62,images/fd996fdccb07aa8759f1388a0dea343a.jpg
zero-history-(blue-ant-#3),Zero History (Blue Ant #3),,,Â£34.77,images/c6e99bbab7370aec1922a3b37b5acbe2.jpg
wuthering-heights,Wuthering Heights,,,Â£17.73,images/d8644073d00c000cb60643256080cc4b.jpg
world-war-z:-an-oral-history-of-the-zombie-war,World War Z: An Oral History of the Zombie War,,,Â£21.80,images/121ae6f29c52eb01f2bec02407bc3e57.jpg
wild:-from-lost-to-found-on-the-pacific-crest-trail,Wild: From Lost to Found on the Pacific Crest Trail,,,Â£46.02,images/d3347aba8346ccff1dcf3751b4e5b9ab.jpg
"where'd-you-go,-bernadette","Where'd You Go, Bernadette",,,Â£18.13,images/8e5d5553e08df59154701c1448b40e20.jpg
we-the-people:-the-modern-day-figures-who-have-reshaped-and-affirmed-the-founding-fathers'-vision-of-america,We the People: The Modern-Day Figures Who Have Reshaped and Affirmed the Founding Fathers' Vision of America,,,Â£31.95,images/b945e870e5188ce6dabbf79ed98b10f1.jpg
we-are-all-completely-beside-ourselves,We Are All Completely Beside Ourselves,,,Â£24.04,images/8d95f4fd1ea785555a28d6371444ce6d.jpg
when-you-are-engulfed-in-flames,When You Are Engulfed in Flames,,,Â£30.89,images/421afe48509fc8cccccad804b64c58dc.jpg
voyager-(outlander-#3),Voyager (Outlander #3),,,Â£21.07,images/6e22497cbecedef59be86d1328e4b044.jpg
walk-the-edge-(thunder-road-#2),Walk the Edge (Thunder Road #2),,,Â£32.36,images/3fc5fbb8ab3099a5fae8f5d180605905.jpg
very-good-lives:-the-fringe-benefits-of-failure-and-the-importance-of-imagination,Very Good Lives: The Fringe Benefits of Failure and the Importance of Imagination,,,Â£50.66,images/fd264a20852bbecf647475d968ac0409.jpg
vegan-vegetarian-omnivore:-dinner-for-everyone-at-the-table,Vegan Vegetarian Omnivore: Dinner for Everyone at the Table,,,Â£13.66,images/a1c7dfc9ebc338043cb0420a49f58f5e.jpg
under-the-banner-of-heaven:-a-story-of-violent-faith,Under the Banner of Heaven: A Story of Violent Faith,,,Â£30.00,images/0a44a38a50b7d61facccae446cf30630.jpg
"unstuffed:-decluttering-your-home,-mind,-and-soul","Unstuffed: Decluttering Your Home, Mind, and Soul",,,Â£58.09,images/682d1c7c8aa1010bd138203ae9d2d10b.jpg
twilight-(twilight-#1),Twilight (Twilight #1),,,Â£41.93,images/05220e25687e267099f0aeb329b6f3cc.jpg
two-boys-kissing,Two Boys Kissing,,,Â£32.74,images/a029efdcb7e61cc2fed1f7404cf065a0.jpg
"trespassing-across-america:-one-man's-epic,-never-done-before-(and-sort-of-illegal)-hike-across-the-heartland","Trespassing Across America: One Man's Epic, Never-Done-Before (and Sort of Illegal) Hike Across the Heartland",,,Â£53.51,images/fb6511ce55f5cf2ebf22a90655ad7c42.jpg
three-martini-lunch,Three-Martini Lunch,,,Â£23.21,images/fcc2f183dde593b991e01585f5df1e09.jpg
twenties-girl,Twenties Girl,,,Â£42.80,images/49ec020f1dfa44313313495b809f74f1.jpg
"thinking,-fast-and-slow","Thinking, Fast and Slow",,,Â£21.14,images/7d9ba3173dcc0194ec63f9c77d0763cb.jpg
"the-wicked-+-the-divine,-vol.-3:-commercial-suicide-(the-wicked-+-the-divine)","The Wicked + The Divine, Vol. 3: Commercial Suicide (The Wicked + The Divine)",,,Â£14.41,images/33cb44fb2984e4d09dc2263c50b36927.jpg
the-wild-robot,The Wild Robot,,,Â£56.07,images/424876ee529de5b557ebd69286c87343.jpg
the-undomestic-goddess,The Undomestic Goddess,,,Â£45.75,images/e3e95f631eb64252324768ce795b50d7.jpg
the-travelers,The Travelers,,,Â£15.77,images/42a345bdcb3e13d5922ff79cd1c07d0e.jpg
the-tipping-point:-how-little-things-can-make-a-big-difference,The Tipping Point: How Little Things Can Make a Big Difference,,,Â£10.02,images/baab7240d3d472f4f868ae8b4481365b.jpg
the-stand,The Stand,,,Â£57.86,images/f98bdf42af5e223bc0f6ea6bd0a48a53.jpg
the-thing-about-jellyfish,The Thing About Jellyfish,,,Â£48.77,images/efd3fd5390be3a440e28b03b5bb0fd95.jpg
the-smitten-kitchen-cookbook,The Smitten Kitchen Cookbook,,,Â£23.59,images/93cb59d2fa8bab28812989e1a33b4cae.jpg
"the-sandman,-vol.-3:-dream-country-(the-sandman-(volumes)-#3)","The Sandman, Vol. 3: Dream Country (The Sandman (volumes) #3)",,,Â£55.55,images/df96b9a9739d2421620bfb3622f3c2d0.jpg
the-silkworm-(cormoran-strike-#2),The Silkworm (Cormoran Strike #2),,,Â£23.05,images/fad227281b25d606782218a33323991b.jpg
the-rose-&-the-dagger-(the-wrath-and-the-dawn-#2),The Rose & the Dagger (The Wrath and the Dawn #2),,,Â£58.64,images/a9b62c069312790dd2d408b0b57a2976.jpg
the-road-to-little-dribbling:-adventures-of-an-american-in-britain-(notes-from-a-small-island-#2),The Road to Little Dribbling: Adventures of an American in Britain (Notes From a Small Island #2),,,Â£23.21,images/26f5d20239a45046e756c6d09611b3ea.jpg
the-rise-of-theodore-roosevelt-(theodore-roosevelt-#1),The Rise of Theodore Roosevelt (Theodore Roosevelt #1),,,Â£42.57,images/4c090b85892f532210e44d84b752b64d.jpg
the-rest-is-noise:-listening-to-the-twentieth-century,The Rest Is Noise: Listening to the Twentieth Century,,,Â£34.77,images/fe7494f92b03b9c178cf19a038011f18.jpg
the-restaurant-at-the-end-of-the-universe-(hitchhiker's-guide-to-the-galaxy-#2),The Restaurant at the End of the Universe (Hitchhiker's Guide to the Galaxy #2),,,Â£10.92,images/aa8fc991d84aca12ed94a0a2fa1099e5.jpg
the-red-tent,The Red Tent,,,Â£35.66,images/155942710c3ae4bd4ed622df9a999b99.jpg
the-purpose-driven-life:-what-on-earth-am-i-here-for?,The Purpose Driven Life: What on Earth Am I Here for?,,,Â£37.19,images/e867d03f2a94d84ff1be5800a34b9a95.jpg
the-purest-hook-(second-circle-tattoos-#3),The Purest Hook (Second Circle Tattoos #3),,,Â£12.25,images/c29dbb9c163edb0e885f897063d619f3.jpg
the-picture-of-dorian-gray,The Picture of Dorian Gray,,,Â£29.70,images/67297ff3ae6cb02884c52e5250fe7c1a.jpg
the-paris-wife,The Paris Wife,,,Â£36.80,images/c481876e0c0057308366ba37f7413b7e.jpg
the-obsession,The Obsession,,,Â£45.43,images/a63804d7adf6fb90b70b226702cb4f7b.jpg
the-new-guy-(and-other-senior-year-distractions),The New Guy (and Other Senior Year Distractions),,,Â£44.92,images/2059cab99f3edbb3971347b7a0812cdd.jpg
the-nightingale,The Nightingale,,,Â£26.26,images/c6ac29eaf9e7de9de175d014d2132428.jpg
the-nanny-diaries-(nanny-#1),The Nanny Diaries (Nanny #1),,,Â£52.53,images/e34e69942bf1327c602ef9754d02a022.jpg
the-name-of-god-is-mercy,The Name of God is Mercy,,,Â£37.25,images/017c9fd993b4ebb5676213f6de1f96c5.jpg
the-maze-runner-(the-maze-runner-#1),The Maze Runner (The Maze Runner #1),,,Â£20.93,images/e156706ae507fdd59aa933675a480d07.jpg
the-lover's-dictionary,The Lover's Dictionary,,,Â£58.09,images/0be9284a6b11e3517504aa9a44f87a3a.jpg
the-lonely-ones,The Lonely Ones,,,Â£43.59,images/fff64acb3c65cbea2ac9209c2a57af17.jpg
the-lean-startup:-how-today's-entrepreneurs-use-continuous-innovation-to-create-radically-successful-businesses,The Lean Startup: How Today's Entrepreneurs Use Continuous Innovation to Create Radically Successful Businesses,,,Â£33.92,images/526e9f360da288db64ca70c89cdbcaa9.jpg
the-last-painting-of-sara-de-vos,The Last Painting of Sara de Vos,,,Â£55.55,images/1ce4c2573d65ebdc3c85d9a6592d57b1.jpg
"the-land-of-10,000-madonnas","The Land of 10,000 Madonnas",,,Â£29.64,images/af82a0cccc29dd467330dab0325807c8.jpg
the-infinities,The Infinities,,,Â£27.41,images/c89ec72cf70f8d37e049223b90708a5a.jpg
the-husband's-secret,The Husband's Secret,,,Â£52.51,images/9527e680e56bb3f8d9bf4e8882a3b723.jpg
the-hitchhiker's-guide-to-the-galaxy-(hitchhiker's-guide-to-the-galaxy-#1),The Hitchhiker's Guide to the Galaxy (Hitchhiker's Guide to the Galaxy #1),,,Â£47.80,images/f4000d1f2348894ec00679674a5b5d4f.jpg
the-guernsey-literary-and-potato-peel-pie-society,The Guernsey Literary and Potato Peel Pie Society,,,Â£49.53,images/98e3925e5e6a66acf2cde918fc147205.jpg
the-guns-of-august,The Guns of August,,,Â£14.54,images/ca23598be538026a7898232e8a1079d0.jpg
the-goldfinch,The Goldfinch,,,Â£43.58,images/d3afd585a95c0b8b59f73f2948cef8c8.jpg
the-girl-with-all-the-gifts,The Girl with All the Gifts,,,Â£49.47,images/9a911066cb404976bcc25dbc8817432a.jpg
the-giver-(the-giver-quartet-#1),The Giver (The Giver Quartet #1),,,Â£12.30,images/fea18082a98781b8e87bdf99065f4887.jpg
the-girl-who-played-with-fire-(millennium-trilogy-#2),The Girl Who Played with Fire (Millennium Trilogy #2),,,Â£22.14,images/217f8cd244c5dfbd2ed860695694f545.jpg
the-girl-who-kicked-the-hornet's-nest-(millennium-trilogy-#3),The Girl Who Kicked the Hornet's Nest (Millennium Trilogy #3),,,Â£57.48,images/fbc5ed73ca9452af655115c7bd006e83.jpg
the-exiled,The Exiled,,,Â£43.45,images/dd29147b962e4480491cac5bce41e4e4.jpg
"the-elegant-universe:-superstrings,-hidden-dimensions,-and-the-quest-for-the-ultimate-theory","The Elegant Universe: Superstrings, Hidden Dimensions, and the Quest for the Ultimate Theory",,,Â£13.03,images/5edba3f8d50df6306bc5aa3f2516bd0c.jpg
"the-end-of-faith:-religion,-terror,-and-the-future-of-reason","The End of Faith: Religion, Terror, and the Future of Reason",,,Â£22.13,images/69978f609f9c1cb470ce1aa0774cf9d1.jpg
"the-disappearing-spoon:-and-other-true-tales-of-madness,-love,-and-the-history-of-the-world-from-the-periodic-table-of-the-elements","The Disappearing Spoon: And Other True Tales of Madness, Love, and the History of the World from the Periodic Table of the Elements",,,Â£57.35,images/47cd27d1ae8935f974541829eea328f2.jpg
the-devil-wears-prada-(the-devil-wears-prada-#1),The Devil Wears Prada (The Devil Wears Prada #1),,,Â£44.29,images/21acb843702d1448519cc8bf0d5da728.jpg
the-demon-haunted-world:-science-as-a-candle-in-the-dark,The Demon-Haunted World: Science as a Candle in the Dark,,,Â£52.25,images/f2a18461821c1842a4bc8041de6a8d40.jpg
the-day-the-crayons-came-home-(crayons),The Day the Crayons Came Home (Crayons),,,Â£26.33,images/34b2631bafd148bcd8dcd850a4b75971.jpg
the-da-vinci-code-(robert-langdon-#2),The Da Vinci Code (Robert Langdon #2),,,Â£22.96,images/90810ccd85e7f49b9040246800a19b44.jpg
the-cuckoo's-calling-(cormoran-strike-#1),The Cuckoo's Calling (Cormoran Strike #1),,,Â£19.21,images/72ec24f082aba608ca37bc3aeaf57317.jpg
the-complete-stories-and-poems-(the-works-of-edgar-allan-poe-[cameo-edition]),The Complete Stories and Poems (The Works of Edgar Allan Poe [Cameo Edition]),,,Â£26.78,images/552d55d44dcc0f27e98b3e7dc3959e1a.jpg
the-complete-poems,The Complete Poems,,,Â£41.32,images/e5cb32b76ae2e45823f1d50446c9ae58.jpg
the-catcher-in-the-rye,The Catcher in the Rye,,,Â£24.55,images/b4540e3eb2e980d0c2b45c5c4432f28b.jpg
the-cat-in-the-hat-(beginner-books-b-1),The Cat in the Hat (Beginner Books B-1),,,Â£16.26,images/3c4578b3f58e5b4afea86f886b201fd8.jpg
the-case-for-christ-(cases-for-christianity),The Case for Christ (Cases for Christianity),,,Â£47.84,images/fc42d56ac8d3ee46bfea880d0cf46a5e.jpg
the-book-thief,The Book Thief,,,Â£53.49,images/540bd6b063db9cc37fcfa7d9d8a97c7d.jpg
the-blind-side:-evolution-of-a-game,The Blind Side: Evolution of a Game,,,Â£53.71,images/a22a10fdc420dce290c7c85dde23f093.jpg
the-book-of-basketball:-the-nba-according-to-the-sports-guy,The Book of Basketball: The NBA According to The Sports Guy,,,Â£44.84,images/73bbe0a70806f8a732b9a7a7a343c5ec.jpg
the-autobiography-of-malcolm-x,The Autobiography of Malcolm X,,,Â£23.43,images/d74ddd5fd851eb01a201e7de7f4d5832.jpg
"the-art-of-simple-food:-notes,-lessons,-and-recipes-from-a-delicious-revolution","The Art of Simple Food: Notes, Lessons, and Recipes from a Delicious Revolution",,,Â£34.32,images/ce507dd8849b38d2c3eebb0e691c1aab.jpg
the-art-of-fielding,The Art of Fielding,,,Â£22.10,images/8afee4ecfc952010bcb70f72e4728d16.jpg
"surely-you're-joking,-mr.-feynman!:-adventures-of-a-curious-character","Surely You're Joking, Mr. Feynman!: Adventures of a Curious Character",,,Â£25.83,images/a550edf8668b36d52d37080a804944ab.jpg
stiff:-the-curious-lives-of-human-cadavers,Stiff: The Curious Lives of Human Cadavers,,,Â£36.74,images/0001685f344cae0e6921bc3f8256b54e.jpg
something-borrowed-(darcy-&-rachel-#1),Something Borrowed (Darcy & Rachel #1),,,Â£48.96,images/82ed95c8c6c3ee6171fe3b55d766a9ec.jpg
spilled-milk:-based-on-a-true-story,Spilled Milk: Based on a True Story,,,Â£49.51,images/2ea30e892e0060412f854b31a4e72e47.jpg
something-blue-(darcy-&-rachel-#2),Something Blue (Darcy & Rachel #2),,,Â£54.62,images/2926c885f673e84d7fc46240b1f77eb2.jpg
shopaholic-&-baby-(shopaholic-#5),Shopaholic & Baby (Shopaholic #5),,,Â£46.45,images/75b1b239670c929c4e17b9a67ebb6272.jpg
soldier-(talon-#3),Soldier (Talon #3),,,Â£24.72,images/7915bf4c3d1a2f7fd39c4edff580e91f.jpg
seven-days-in-the-art-world,Seven Days in the Art World,,,Â£52.33,images/922f6fcd3282a0da76cc14fc13ae2411.jpg
seven-brief-lessons-on-physics,Seven Brief Lessons on Physics,,,Â£30.60,images/aef933758e39ba5e4327b2152478bb1a.jpg
scarlet-(the-lunar-chronicles-#2),Scarlet (The Lunar Chronicles #2),,,Â£14.57,images/9704e3b9203e9b029134d0b86c17613b.jpg
sarah's-key,Sarah's Key,,,Â£46.29,images/3694ded38770738af6a6959636124331.jpg
rogue-lawyer-(rogue-lawyer-#1),Rogue Lawyer (Rogue Lawyer #1),,,Â£50.11,images/2dd096d0fa0af96560c16aeffea83d4a.jpg
"saga,-volume-3-(saga-(collected-editions)-#3)","Saga, Volume 3 (Saga (Collected Editions) #3)",,,Â£21.57,images/5589eb7a8127d04add1c4205186d91d4.jpg
running-with-scissors,Running with Scissors,,,Â£12.91,images/4ce1ed40df359e001020e1ea55674381.jpg
"rise-of-the-rocket-girls:-the-women-who-propelled-us,-from-missiles-to-the-moon-to-mars","Rise of the Rocket Girls: The Women Who Propelled Us, from Missiles to the Moon to Mars",,,Â£41.67,images/1c41d9cb63d3627fc60a1f3ba42da963.jpg
rework,Rework,,,Â£44.88,images/12233a9d0bf8187a988c27c6a54b3d31.jpg
reservations-for-two,Reservations for Two,,,Â£11.10,images/7a13d10c37d4b975145bfa493f69fbf0.jpg
red:-the-true-story-of-red-riding-hood,Red: The True Story of Red Riding Hood,,,Â£28.54,images/9ddd21ce54bf11eb84bf6986decb9915.jpg
ready-player-one,Ready Player One,,,Â£19.07,images/b9afd75c09ff7bf82c9a158a34cb993d.jpg
quiet:-the-power-of-introverts-in-a-world-that-can't-stop-talking,Quiet: The Power of Introverts in a World That Can't Stop Talking,,,Â£43.55,images/15fd39b56579a9038ad1233ceb91951d.jpg
prodigy:-the-graphic-novel-(legend:-the-graphic-novel-#2),Prodigy: The Graphic Novel (Legend: The Graphic Novel #2),,,Â£43.63,images/1b8b733db667fc3a7bbca0d65fa078f1.jpg
persepolis:-the-story-of-a-childhood-(persepolis-#1-2),Persepolis: The Story of a Childhood (Persepolis #1-2),,,Â£39.13,images/9d5f4a231a2ee898ed76f603b3e40163.jpg
packing-for-mars:-the-curious-science-of-life-in-the-void,Packing for Mars: The Curious Science of Life in the Void,,,Â£56.68,images/f13365561defe8ad6f80c26d2216633c.jpg
outliers:-the-story-of-success,Outliers: The Story of Success,,,Â£14.16,images/7c7f3a48d03cdbdd87c07482711b72f9.jpg
orange-is-the-new-black,Orange Is the New Black,,,Â£24.61,images/c4cf1668dcb49c698e8cc2c6553b1237.jpg
original-fake,Original Fake,,,Â£31.45,images/3999845b6800427aad3d45041586a171.jpg
notes-from-a-small-island-(notes-from-a-small-island-#1),Notes from a Small Island (Notes From a Small Island #1),,,Â£40.17,images/8f40ba4f73d2c70e0ccc15d77dc3c220.jpg
one-for-the-money-(stephanie-plum-#1),One for the Money (Stephanie Plum #1),,,Â£32.87,images/3f7a775ec9fe618e122e3d3b4f91dc22.jpg
night-(the-night-trilogy-#1),Night (The Night Trilogy #1),,,Â£13.51,images/b245b0b715de260634e66a05a024cc52.jpg
naked,Naked,,,Â£31.69,images/802b92421a7314b0a6afef8a9754cf5c.jpg
neither-here-nor-there:-travels-in-europe,Neither Here nor There: Travels in Europe,,,Â£38.95,images/c99a7a05537cd842eb4db83d537e3a4d.jpg
morning-star-(red-rising-#3),Morning Star (Red Rising #3),,,Â£29.40,images/534bffd5988b0ddf6b587de76fa63d9a.jpg
"miracles-from-heaven:-a-little-girl,-her-journey-to-heaven,-and-her-amazing-story-of-healing","Miracles from Heaven: A Little Girl, Her Journey to Heaven, and Her Amazing Story of Healing",,,Â£57.83,images/60cda3c756f14ef6625b979cfeb230ea.jpg
midnight-riot-(peter-grant/-rivers-of-london---books-#1),Midnight Riot (Peter Grant/ Rivers of London - books #1),,,Â£55.46,images/cd65e4ee648ae23f6cdafb41e4948d6e.jpg
me-talk-pretty-one-day,Me Talk Pretty One Day,,,Â£57.60,images/61b220c2079a45a7975a397c8849e00e.jpg
lust-&-wonder,Lust & Wonder,,,Â£11.87,images/251ce4355601534338a646f2b63be93a.jpg
manuscript-found-in-accra,Manuscript Found in Accra,,,Â£34.98,images/d9540861f39f0b181b3fb13d57025f0c.jpg
lila-(gilead-#3),Lila (Gilead #3),,,Â£12.47,images/9b37bcfb1a44dabbef36f5bf899df4b0.jpg
"life,-the-universe-and-everything-(hitchhiker's-guide-to-the-galaxy-#3)","Life, the Universe and Everything (Hitchhiker's Guide to the Galaxy #3)",,,Â£33.26,images/54cac05a3026d35e713133a1fe49f6c8.jpg
life-without-a-recipe,Life Without a Recipe,,,Â£59.04,images/9e4fb935df3113056cc9bdee6cd09ea6.jpg
letter-to-a-christian-nation,Letter to a Christian Nation,,,Â£22.20,images/8821ea9cd21326e41e095619b822a4a8.jpg
life-after-life,Life After Life,,,Â£26.13,images/604b6a188b8ad3cfaeda67039399fcb6.jpg
let's-pretend-this-never-happened:-a-mostly-true-memoir,Let's Pretend This Never Happened: A Mostly True Memoir,,,Â£45.11,images/f58a15a50b2d70a4a8fd4fa6485a7009.jpg
legend-(legend-#1),Legend (Legend #1),,,Â£43.69,images/578f1512a0f0a9d3c2ab9543f7b4506f.jpg
"lean-in:-women,-work,-and-the-will-to-lead","Lean In: Women, Work, and the Will to Lead",,,Â£25.02,images/c24fc1d77ec9dd6e0c863484041c482f.jpg
"lamb:-the-gospel-according-to-biff,-christ's-childhood-pal","Lamb: The Gospel According to Biff, Christ's Childhood Pal",,,Â£55.50,images/c469440eeffdd84ac3f4b09bd575c548.jpg
lady-renegades-(rebel-belle-#3),Lady Renegades (Rebel Belle #3),,,Â£53.04,images/8636b9056ea6930c153cd1d5b4aed36a.jpg
jurassic-park-(jurassic-park-#1),Jurassic Park (Jurassic Park #1),,,Â£44.97,images/269e8962f39f359559a46cae86576128.jpg
it's-never-too-late-to-begin-again:-discovering-creativity-and-meaning-at-midlife-and-beyond,It's Never Too Late to Begin Again: Discovering Creativity and Meaning at Midlife and Beyond,,,Â£42.38,images/27f54466115767b767133ee034543cb5.jpg
into-the-wild,Into the Wild,,,Â£56.70,images/dec9168a8a3876b60feedb68aeb0225b.jpg
is-everyone-hanging-out-without-me?-(and-other-concerns),Is Everyone Hanging Out Without Me? (And Other Concerns),,,Â£20.11,images/804fbcee4a4afa6498badaa12709c049.jpg
inferno-(robert-langdon-#4),Inferno (Robert Langdon #4),,,Â£41.00,images/ec15a39e6f193636635f20a7354b08f6.jpg
"in-the-garden-of-beasts:-love,-terror,-and-an-american-family-in-hitler's-berlin","In the Garden of Beasts: Love, Terror, and an American Family in Hitler's Berlin",,,Â£28.85,images/b5a295c15ac586c6daa84e6e20f47b06.jpg
if-i-run-(if-i-run-#1),If I Run (If I Run #1),,,Â£49.97,images/54179d9af49616b1ef35a0bb23294b14.jpg
i've-got-your-number,I've Got Your Number,,,Â£19.69,images/3d407a69fe55223fb4cfec577a9a8ee2.jpg
i-am-malala:-the-girl-who-stood-up-for-education-and-was-shot-by-the-taliban,I Am Malala: The Girl Who Stood Up for Education and Was Shot by the Taliban,,,Â£28.88,images/69077c48327b2702f44adc035fcc1ce4.jpg
hungry-girl-clean-&-hungry:-easy-all-natural-recipes-for-healthy-eating-in-the-real-world,Hungry Girl Clean & Hungry: Easy All-Natural Recipes for Healthy Eating in the Real World,,,Â£33.14,images/54630f76b730d2d00dc8d75921992af2.jpg
"house-of-lost-worlds:-dinosaurs,-dynasties,-and-the-story-of-life-on-earth","House of Lost Worlds: Dinosaurs, Dynasties, and the Story of Life on Earth",,,Â£43.70,images/f5b783f6cfdfe30895d912f9e337bb22.jpg
horrible-bear!,Horrible Bear!,,,Â£37.52,images/9f9c8afb3befd7ab2629c76983445766.jpg
house-of-leaves,House of Leaves,,,Â£54.89,images/20c2ff61355569b4f84e2f847e37db25.jpg
holidays-on-ice,Holidays on Ice,,,Â£51.07,images/574cbab555bb7d21e50b20267383e45d.jpg
heir-to-the-sky,Heir to the Sky,,,Â£44.07,images/36393f3294ab28afe4a2117fc987be75.jpg
green-eggs-and-ham-(beginner-books-b-16),Green Eggs and Ham (Beginner Books B-16),,,Â£10.79,images/38916e718a4a117d62cbb8e10c7443ff.jpg
gratitude,Gratitude,,,Â£26.66,images/5673fea5d08ad840ade774146ce07b28.jpg
"grayson,-vol-3:-nemesis-(grayson-#3)","Grayson, Vol 3: Nemesis (Grayson #3)",,,Â£42.72,images/a9105d5dbdc6a339c21d6635b3dc1697.jpg
gone-girl,Gone Girl,,,Â£37.60,images/7321b201d1c51a1c3b777a72c4bc0ea9.jpg
