Handle,Title,Body (HTML),Vendor,Variant Price,Image Src
you-are-what-you-love:-the-spiritual-power-of-habit,You Are What You Love: The Spiritual Power of Habit,,,Â£21.87,images/529bf0d806ae2ab02bf23da4326b24c3.jpg
the-bhagavad-gita,The Bhagavad Gita,,,Â£57.49,images/13270087ac5cba3e999166a64991187a.jpg
choosing-our-religion:-the-spiritual-lives-of-america's-nones,Choosing Our Religion: The Spiritual Lives of America's Nones,,,Â£28.42,images/e98a7adb82052fb13418a43291b8f0d4.jpg
"a-history-of-god:-the-4,000-year-quest-of-judaism,-christianity,-and-islam","A History of God: The 4,000-Year Quest of Judaism, Christianity, and Islam",,,Â£27.62,images/fd996fdccb07aa8759f1388a0dea343a.jpg
the-book-of-mormon,The Book of Mormon,,,Â£24.57,images/d7c885771d5e843cc2db6b0e5183c0c5.jpg
god:-the-most-unpleasant-character-in-all-fiction,God: The Most Unpleasant Character in All Fiction,,,Â£30.03,images/41d8915a712c2a56f1c5182c11445551.jpg
"don't-be-a-jerk:-and-other-practical-advice-from-dogen,-japan's-greatest-zen-master","Don't Be a Jerk: And Other Practical Advice from Dogen, Japan's Greatest Zen Master",,,Â£37.97,images/a79cac7aec3816fb754c1aedd2e82986.jpg
logan-kade-(fallen-crest-high-#5.5),Logan Kade (Fallen Crest High #5.5),,,Â£13.12,images/2b4404e00c242bf1b8263bdd99c07354.jpg
why-the-right-went-wrong:-conservatism--from-goldwater-to-the-tea-party-and-beyond,Why the Right Went Wrong: Conservatism--From Goldwater to the Tea Party and Beyond,,,Â£52.65,images/cd64ccda3382d62fea8167eaadd6c9a0.jpg
libertarianism-for-beginners,Libertarianism for Beginners,,,Â£51.33,images/91a46253e165d144ef5938f2d456b88f.jpg
equal-is-unfair:-america's-misguided-fight-against-income-inequality,Equal Is Unfair: America's Misguided Fight Against Income Inequality,,,Â£56.86,images/a63b2576d798c2041c602561499a26aa.jpg
scarlett-epstein-hates-it-here,Scarlett Epstein Hates It Here,,,Â£43.55,images/7eba21a2ecaa4651e44f04a7cd808520.jpg
set-me-free,Set Me Free,,,Â£17.46,images/b8e91bd2fc74c3954118999238abb4b8.jpg
"nightingale,-sing","Nightingale, Sing",,,Â£38.28,images/97e65c8381cc80ba1107c3ce81c4878d.jpg
obsidian-(lux-#1),Obsidian (Lux #1),,,Â£14.86,images/883fb0f2304efca8724c629f03a4b82a.jpg
burning,Burning,,,Â£28.81,images/9a2c2936fa9bd422be96805924e1411a.jpg
a-fierce-and-subtle-poison,A Fierce and Subtle Poison,,,Â£28.13,images/acb65d6d11263ba98b0191b544f6c728.jpg
the-requiem-red,The Requiem Red,,,Â£22.65,images/6b07b77236b7c80f42bd90bf325e69f6.jpg
the-natural-history-of-us-(the-fine-art-of-pretending-#2),The Natural History of Us (The Fine Art of Pretending #2),,,Â£45.22,images/dab87c14168f3ce18530447ec6437361.jpg
frostbite-(vampire-academy-#2),Frostbite (Vampire Academy #2),,,Â£29.99,images/2a2d6ebcedeb7249a2a85fd1fbfd06e1.jpg
this-is-where-it-ends,This Is Where It Ends,,,Â£27.12,images/8edc314a67ed5ddad7bd0a2f30ad3238.jpg
library-of-souls-(miss-peregrineâs-peculiar-children-#3),Library of Souls (Miss Peregrineâs Peculiar Children #3),,,Â£48.56,images/797a5468a7d06aba28d1cc7342b1f2ba.jpg
wild-swans,Wild Swans,,,Â£14.36,images/ad42a85570a887faf1b9e12715cf59bf.jpg
don't-get-caught,Don't Get Caught,,,Â£55.35,images/78112d48a74583a7acc24a2b46a9f59d.jpg
until-friday-night-(the-field-party-#1),Until Friday Night (The Field Party #1),,,Â£46.31,images/e1249f72129bd4b788ffd0cdd7834c24.jpg
the-darkest-lie,The Darkest Lie,,,Â£35.35,images/3b6ae7b1d7736819f4f44605441e283e.jpg
my-kind-of-crazy,My Kind of Crazy,,,Â£40.36,images/2b38dc9b90299a9755fb15bed3293342.jpg
aristotle-and-dante-discover-the-secrets-of-the-universe-(aristotle-and-dante-discover-the-secrets-of-the-universe-#1),Aristotle and Dante Discover the Secrets of the Universe (Aristotle and Dante Discover the Secrets of the Universe #1),,,Â£58.14,images/e53a42b20d0c60634289aaad3fbb75c6.jpg
catching-jordan-(hundred-oaks),Catching Jordan (Hundred Oaks),,,Â£50.83,images/f48b76634af0040d4eea1ee896d3676b.jpg
"exit,-pursued-by-a-bear","Exit, Pursued by a Bear",,,Â£51.34,images/fc8c996d0976a29c5c37bc11923a02f1.jpg
don't-forget-steven,Don't Forget Steven,,,Â£33.23,images/0eea83f8c3d5d3bf8538f046e2a4c67d.jpg
stars-above-(the-lunar-chronicles-#4.5),Stars Above (The Lunar Chronicles #4.5),,,Â£48.05,images/8f221677f6d28eba048ebb505fcfd90a.jpg
the-epidemic-(the-program-0.6),The Epidemic (The Program 0.6),,,Â£14.44,images/b62f16c69886271a55d3717883323283.jpg
no-love-allowed-(dodge-cove-#1),No Love Allowed (Dodge Cove #1),,,Â£54.65,images/41e1fc6ac1122d77a6308544dba8c21e.jpg
the-alien-club,The Alien Club,,,Â£54.40,images/157c526f6978d80e039e1362ae898fc8.jpg
south-of-sunshine,South of Sunshine,,,Â£28.93,images/3465383539467c7e1787d26c02bca66f.jpg
"will-grayson,-will-grayson-(will-grayson,-will-grayson)","Will Grayson, Will Grayson (Will Grayson, Will Grayson)",,,Â£47.31,images/b9e66a23fe4b95c426409bad86058152.jpg
where-she-went-(if-i-stay-#2),Where She Went (If I Stay #2),,,Â£41.73,images/0cf93861d70a35c3d8deaa265a630e35.jpg
my-life-next-door-(my-life-next-door-),My Life Next Door (My Life Next Door ),,,Â£36.39,images/1a2c80cc391bc1422013e31682c5f649.jpg
tell-the-wolves-i'm-home,Tell the Wolves I'm Home,,,Â£50.96,images/784872c69237efaf5df8c0282280ff05.jpg
future-shock-(future-shock-#1),Future Shock (Future Shock #1),,,Â£55.65,images/7cebcafb82ec5f208d1613b35337d59d.jpg
nightstruck:-a-novel,Nightstruck: A Novel,,,Â£50.35,images/cbda49820de480220af3dff2d30c689a.jpg
two-summers,Two Summers,,,Â£14.64,images/cd1ab47070ea1662d4917d7ad483ed53.jpg
tell-me-three-things,Tell Me Three Things,,,Â£41.81,images/92a5e01c5067f65f03b316a328459f9f.jpg
kill-the-boy-band,Kill the Boy Band,,,Â£15.52,images/6e66e7cefe3ca7cf9402f87f3e13c79e.jpg
the-darkest-corners,The Darkest Corners,,,Â£11.33,images/8c64037f38663260b91c275078ee882d.jpg
lola-and-the-boy-next-door-(anna-and-the-french-kiss-#2),Lola and the Boy Next Door (Anna and the French Kiss #2),,,Â£23.63,images/1e12b33f2f3988b23f895d2319ef7af8.jpg
an-abundance-of-katherines,An Abundance of Katherines,,,Â£10.00,images/9bc86bc10a6beea536422bbe82e076fb.jpg
isla-and-the-happily-ever-after-(anna-and-the-french-kiss-#3),Isla and the Happily Ever After (Anna and the French Kiss #3),,,Â£48.13,images/61ffcc9619675c79b1f0b568d6ee870c.jpg
harry-potter-and-the-prisoner-of-azkaban-(harry-potter-#3),Harry Potter and the Prisoner of Azkaban (Harry Potter #3),,,Â£24.17,images/2793d4ce3d27cdcdb7a0961bc218b25f.jpg
walk-the-edge-(thunder-road-#2),Walk the Edge (Thunder Road #2),,,Â£32.36,images/3fc5fbb8ab3099a5fae8f5d180605905.jpg
two-boys-kissing,Two Boys Kissing,,,Â£32.74,images/a029efdcb7e61cc2fed1f7404cf065a0.jpg
the-new-guy-(and-other-senior-year-distractions),The New Guy (and Other Senior Year Distractions),,,Â£44.92,images/2059cab99f3edbb3971347b7a0812cdd.jpg
scarlet-(the-lunar-chronicles-#2),Scarlet (The Lunar Chronicles #2),,,Â£14.57,images/9704e3b9203e9b029134d0b86c17613b.jpg
legend-(legend-#1),Legend (Legend #1),,,Â£43.69,images/578f1512a0f0a9d3c2ab9543f7b4506f.jpg
"the-land-of-10,000-madonnas","The Land of 10,000 Madonnas",,,Â£29.64,images/af82a0cccc29dd467330dab0325807c8.jpg
cinder-(the-lunar-chronicles-#1),Cinder (The Lunar Chronicles #1),,,Â£26.09,images/552d4630bed694b33b042990e30722d3.jpg
golden-(heart-of-dread-#3),Golden (Heart of Dread #3),,,Â£42.21,images/c28ba565e29fd6879ccf4738fbf06696.jpg
lady-renegades-(rebel-belle-#3),Lady Renegades (Rebel Belle #3),,,Â£53.04,images/8636b9056ea6930c153cd1d5b4aed36a.jpg
boy-meets-boy,Boy Meets Boy,,,Â£21.12,images/863c3b48499a99392aace127df8b43e5.jpg
new-moon-(twilight-#2),New Moon (Twilight #2),,,Â£12.86,images/dcd6ccbed1f8003d5bf53e2791c5abe7.jpg
the-haters,The Haters,,,Â£27.89,images/4a1370ebafcaf6ba5f5e1fe4a609b6d8.jpg
annie-on-my-mind,Annie on My Mind,,,Â£36.83,images/782c8d1e4ab324d978c5dadca02e8cd8.jpg
girl-online-on-tour-(girl-online-#2),Girl Online On Tour (Girl Online #2),,,Â£53.47,images/5a36c880b8762469cd3d67dc05427128.jpg
the-art-of-not-breathing,The Art of Not Breathing,,,Â£40.83,images/0b9f43b6b5cf8053dd2c68ecafe70b8a.jpg
tipping-point-for-planet-earth:-how-close-are-we-to-the-edge?,Tipping Point for Planet Earth: How Close Are We to the Edge?,,,Â£37.55,images/8ecbec21e76445ee83229a439e22aeaa.jpg
the-origin-of-species,The Origin of Species,,,Â£10.01,images/d54527d34174d5dd7eaeaaffdfcb3c5c.jpg
the-most-perfect-thing:-inside-(and-outside)-a-bird's-egg,The Most Perfect Thing: Inside (and Outside) a Bird's Egg,,,Â£42.96,images/a39e7c5c9fc61c2ae0f81116aa8cbb0e.jpg
"the-fabric-of-the-cosmos:-space,-time,-and-the-texture-of-reality","The Fabric of the Cosmos: Space, Time, and the Texture of Reality",,,Â£55.91,images/b25a722c3bab8b311454bc251a75334a.jpg
sorting-the-beef-from-the-bull:-the-science-of-food-fraud-forensics,Sorting the Beef from the Bull: The Science of Food Fraud Forensics,,,Â£44.74,images/5da545b9d44464af8b3d0a9511a050ca.jpg
immunity:-how-elie-metchnikoff-changed-the-course-of-modern-medicine,Immunity: How Elie Metchnikoff Changed the Course of Modern Medicine,,,Â£57.36,images/e11e7e9514a123aee2415a1def85e638.jpg
diary-of-a-citizen-scientist:-chasing-tiger-beetles-and-other-new-ways-of-engaging-the-world,Diary of a Citizen Scientist: Chasing Tiger Beetles and Other New Ways of Engaging the World,,,Â£28.41,images/295ca7f5981786e8b2c6616d10158808.jpg
the-grand-design,The Grand Design,,,Â£13.76,images/9b696c2064d6ee387774b6121bb4be91.jpg
peak:-secrets-from-the-new-science-of-expertise,Peak: Secrets from the New Science of Expertise,,,Â£16.28,images/7c04c7a92b5ba83361eba81fa364a2ca.jpg
"the-elegant-universe:-superstrings,-hidden-dimensions,-and-the-quest-for-the-ultimate-theory","The Elegant Universe: Superstrings, Hidden Dimensions, and the Quest for the Ultimate Theory",,,Â£13.03,images/5edba3f8d50df6306bc5aa3f2516bd0c.jpg
"surely-you're-joking,-mr.-feynman!:-adventures-of-a-curious-character","Surely You're Joking, Mr. Feynman!: Adventures of a Curious Character",,,Â£25.83,images/a550edf8668b36d52d37080a804944ab.jpg
"the-disappearing-spoon:-and-other-true-tales-of-madness,-love,-and-the-history-of-the-world-from-the-periodic-table-of-the-elements","The Disappearing Spoon: And Other True Tales of Madness, Love, and the History of the World from the Periodic Table of the Elements",,,Â£57.35,images/47cd27d1ae8935f974541829eea328f2.jpg
the-selfish-gene,The Selfish Gene,,,Â£29.45,images/d763b806d6f0fb6580f16d08e00bdba6.jpg
seven-brief-lessons-on-physics,Seven Brief Lessons on Physics,,,Â£30.60,images/aef933758e39ba5e4327b2152478bb1a.jpg
a-light-in-the-attic,A Light in the Attic,,,Â£51.77,images/fe72f0532301ec28892ae79a629a293c.jpg
you-can't-bury-them-all:-poems,You can't bury them all: Poems,,,Â£33.63,images/b7440aa88046b0bf8cba50d59295518e.jpg
olio,Olio,,,Â£23.88,images/b10eabab1e1c811a6d47969904fd5755.jpg
the-black-maria,The Black Maria,,,Â£52.15,images/d17a3e313e52e1be5651719e4fba1d16.jpg
slow-states-of-collapse:-poems,Slow States of Collapse: Poems,,,Â£57.31,images/dbac3faca8a799824f5725d66c0fcce3.jpg
shakespeare's-sonnets,Shakespeare's Sonnets,,,Â£20.66,images/4d7a79a8be80a529b277ed5c4d8ba482.jpg
poems-that-make-grown-women-cry,Poems That Make Grown Women Cry,,,Â£14.19,images/18ac3f16b10a5fc47e603d93335e3f24.jpg
untitled-collection:-sabbath-poems-2014,Untitled Collection: Sabbath Poems 2014,,,Â£14.27,images/656e79dfd4f8b6bf19ffde2c75ceda81.jpg
salt.,salt.,,,Â£46.78,images/c9924f9637aef6d9fc8e165be62f69ee.jpg
night-sky-with-exit-wounds,Night Sky with Exit Wounds,,,Â£41.05,images/ff48b0696fb97b7f7b5c6d15e372cb70.jpg
out-of-print:-city-lights-spotlight-no.-14,Out of Print: City Lights Spotlight No. 14,,,Â£53.64,images/4c5a559bc2edb79e5d48af4dbc813eb2.jpg
"quarter-life-poetry:-poems-for-the-young,-broke-and-hangry","Quarter Life Poetry: Poems for the Young, Broke and Hangry",,,Â£50.89,images/68922093080c377fa521ba64d8d372e1.jpg
howl-and-other-poems,Howl and Other Poems,,,Â£40.45,images/098e81fcea9f6b4c15f6d207301c0085.jpg
les-fleurs-du-mal,Les Fleurs du Mal,,,Â£29.04,images/3d324c0b55c221e9b701d4e772b42ad6.jpg
leave-this-song-behind:-teen-poetry-at-its-best,Leave This Song Behind: Teen Poetry at Its Best,,,Â£51.17,images/5eca840ed2d6f0f0d2f795922cb76741.jpg
the-collected-poems-of-w.b.-yeats-(the-collected-works-of-w.b.-yeats-#1),The Collected Poems of W.B. Yeats (The Collected Works of W.B. Yeats #1),,,Â£15.42,images/b38cadc69f4a2db0aae2ee2867ab8583.jpg
the-crossover,The Crossover,,,Â£38.77,images/25fe373b974387a66ff1dea80f023ccb.jpg
booked,Booked,,,Â£17.49,images/cf3b0341f5f4f4ad2c1439c11d32a9b1.jpg
twenty-love-poems-and-a-song-of-despair,Twenty Love Poems and a Song of Despair,,,Â£30.95,images/ec10f11ff0ea13c17a42d81b03896235.jpg
m-train,M Train,,,Â£27.18,images/f09fd4a3200b94db86364f308ac02530.jpg
life-without-a-recipe,Life Without a Recipe,,,Â£59.04,images/9e4fb935df3113056cc9bdee6cd09ea6.jpg
lust-&-wonder,Lust & Wonder,,,Â£11.87,images/251ce4355601534338a646f2b63be93a.jpg
approval-junkie:-adventures-in-caring-too-much,Approval Junkie: Adventures in Caring Too Much,,,Â£58.81,images/966d8d2afdead087cba0f29a69f89ba5.jpg
lab-girl,Lab Girl,,,Â£40.85,images/26ffcda626a5561e483afa19b58db8ac.jpg
the-argonauts,The Argonauts,,,Â£10.93,images/22d01c710471f94dabfa41083fa3cf4e.jpg
me-talk-pretty-one-day,Me Talk Pretty One Day,,,Â£57.60,images/61b220c2079a45a7975a397c8849e00e.jpg
running-with-scissors,Running with Scissors,,,Â£12.91,images/4ce1ed40df359e001020e1ea55674381.jpg
a-heartbreaking-work-of-staggering-genius,A Heartbreaking Work of Staggering Genius,,,Â£54.29,images/47f3d4f1e85773bf41ba64a036e37994.jpg
the-long-shadow-of-small-ghosts:-murder-and-memory-in-an-american-city,The Long Shadow of Small Ghosts: Murder and Memory in an American City,,,Â£10.97,images/2b50fa031b2411a94bc68de0bbdd96fb.jpg
silence-in-the-dark-(logan-point-#4),Silence in the Dark (Logan Point #4),,,Â£58.33,images/00bf1ae17dde21c66e346dd9c393d6fa.jpg
ways-of-seeing,Ways of Seeing,,,Â£39.51,images/a5542b7abc8673ea8254a3fe93b23e4e.jpg
art-and-fear:-observations-on-the-perils-(and-rewards)-of-artmaking,Art and Fear: Observations on the Perils (and Rewards) of Artmaking,,,Â£48.63,images/87822798b42545d589822bc712dc38a6.jpg
the-story-of-art,The Story of Art,,,Â£41.14,images/7ae92da23efc2f0f4633f9d2cde370f3.jpg
feathers:-displays-of-brilliant-plumage,Feathers: Displays of Brilliant Plumage,,,Â£49.05,images/0ad48326a0d2dbda145c94e1d50ef673.jpg
history-of-beauty,History of Beauty,,,Â£10.29,images/cb74d2953d5249143c3c2e3c281daf6f.jpg
the-new-drawing-on-the-right-side-of-the-brain,The New Drawing on the Right Side of the Brain,,,Â£43.02,images/0a8f6461714ec9868dea0d37c5da5a81.jpg
the-art-book,The Art Book,,,Â£32.34,images/76904c101329aa50b6653f399318970b.jpg
wall-and-piece,Wall and Piece,,,Â£44.18,images/df346322ddfdd3b4da0e34cad17f49dc.jpg
i-know-what-i'm-doing----and-other-lies-i-tell-myself:-dispatches-from-a-life-under-construction,I Know What I'm Doing -- and Other Lies I Tell Myself: Dispatches from a Life Under Construction,,,Â£25.98,images/04ab560690b2383512d2fdf4c6366b1e.jpg
when-you-are-engulfed-in-flames,When You Are Engulfed in Flames,,,Â£30.89,images/421afe48509fc8cccccad804b64c58dc.jpg
the-long-haul-(diary-of-a-wimpy-kid-#9),The Long Haul (Diary of a Wimpy Kid #9),,,Â£44.07,images/b1e6c747381261cd6e60ac9d350c4bab.jpg
dress-your-family-in-corduroy-and-denim,Dress Your Family in Corduroy and Denim,,,Â£43.68,images/9c2bdd3040938c144345a115fb906562.jpg
naked,Naked,,,Â£31.69,images/802b92421a7314b0a6afef8a9754cf5c.jpg
old-school-(diary-of-a-wimpy-kid-#10),Old School (Diary of a Wimpy Kid #10),,,Â£11.83,images/5582626cb185a8eb2914c15d5287afbd.jpg
toddlers-are-a**holes:-it's-not-your-fault,Toddlers Are A**holes: It's Not Your Fault,,,Â£25.55,images/261a092ddd76981beb23a601edf0868b.jpg
"hyperbole-and-a-half:-unfortunate-situations,-flawed-coping-mechanisms,-mayhem,-and-other-things-that-happened","Hyperbole and a Half: Unfortunate Situations, Flawed Coping Mechanisms, Mayhem, and Other Things That Happened",,,Â£14.75,images/251df0eb9b321159b0ee348d4a9da2af.jpg
holidays-on-ice,Holidays on Ice,,,Â£51.07,images/574cbab555bb7d21e50b20267383e45d.jpg
"lamb:-the-gospel-according-to-biff,-christ's-childhood-pal","Lamb: The Gospel According to Biff, Christ's Childhood Pal",,,Â£55.50,images/c469440eeffdd84ac3f4b09bd575c548.jpg
a-distant-mirror:-the-calamitous-14th-century,A Distant Mirror: The Calamitous 14th Century,,,Â£14.58,images/d80ac19cd0aef94c5ac257b1eb3c1d37.jpg
sapiens:-a-brief-history-of-humankind,Sapiens: A Brief History of Humankind,,,Â£54.23,images/ce5f052c65cc963cf4422be096e915c9.jpg
1491:-new-revelations-of-the-americas-before-columbus,1491: New Revelations of the Americas Before Columbus,,,Â£21.80,images/2dd235d80326531092c70e191d630c7d.jpg
zealot:-the-life-and-times-of-jesus-of-nazareth,Zealot: The Life and Times of Jesus of Nazareth,,,Â£24.70,images/21dab5c065cfcde1bad7ded16a753102.jpg
the-age-of-genius:-the-seventeenth-century-and-the-birth-of-the-modern-mind,The Age of Genius: The Seventeenth Century and the Birth of the Modern Mind,,,Â£19.73,images/2e654066306042f4c462ba4d048650d9.jpg
thomas-jefferson-and-the-tripoli-pirates:-the-forgotten-war-that-changed-american-history,Thomas Jefferson and the Tripoli Pirates: The Forgotten War That Changed American History,,,Â£59.64,images/777988a85de2269905bd8c2070a3cf58.jpg
"unbound:-how-eight-technologies-made-us-human,-transformed-society,-and-brought-our-world-to-the-brink","Unbound: How Eight Technologies Made Us Human, Transformed Society, and Brought Our World to the Brink",,,Â£25.52,images/27a1ebe79d6e6759ec68ea9f427a4f71.jpg
"political-suicide:-missteps,-peccadilloes,-bad-calls,-backroom-hijinx,-sordid-pasts,-rotten-breaks,-and-just-plain-dumb-mistakes-in-the-annals-of-american-politics","Political Suicide: Missteps, Peccadilloes, Bad Calls, Backroom Hijinx, Sordid Pasts, Rotten Breaks, and Just Plain Dumb Mistakes in the Annals of American Politics",,,Â£36.28,images/31e6e0a41e62858180b268c27b20a770.jpg
brilliant-beacons:-a-history-of-the-american-lighthouse,Brilliant Beacons: A History of the American Lighthouse,,,Â£11.45,images/ba5913de7abe0d9dbe9c8128092a52af.jpg
the-rise-and-fall-of-the-third-reich:-a-history-of-nazi-germany,The Rise and Fall of the Third Reich: A History of Nazi Germany,,,Â£39.67,images/10f6ebfa89b070ba39ad7c4c872c96ea.jpg
catherine-the-great:-portrait-of-a-woman,Catherine the Great: Portrait of a Woman,,,Â£58.55,images/373af6af58a00ca69602d74b81951ac4.jpg
a-short-history-of-nearly-everything,A Short History of Nearly Everything,,,Â£52.40,images/17aa3d17bae02fa1d0e2a831c0c0e58b.jpg
"""most-blessed-of-the-patriarchs"":-thomas-jefferson-and-the-empire-of-the-imagination","""Most Blessed of the Patriarchs"": Thomas Jefferson and the Empire of the Imagination",,,Â£44.48,images/43f25e9633b587a4052b517cd7b3b4a9.jpg
america's-war-for-the-greater-middle-east:-a-military-history,America's War for the Greater Middle East: A Military History,,,Â£51.22,images/da0ca0d6586f8164b7a96d4c807a6c7f.jpg
the-hiding-place,The Hiding Place,,,Â£55.91,images/74927818a922712c13999a8043f7f35c.jpg
the-mathews-men:-seven-brothers-and-the-war-against-hitler's-u-boats,The Mathews Men: Seven Brothers and the War Against Hitler's U-boats,,,Â£42.91,images/5274c64fbcb7ce4bbf427ed751f6cada.jpg
the-guns-of-august,The Guns of August,,,Â£14.54,images/ca23598be538026a7898232e8a1079d0.jpg
"house-of-lost-worlds:-dinosaurs,-dynasties,-and-the-story-of-life-on-earth","House of Lost Worlds: Dinosaurs, Dynasties, and the Story of Life on Earth",,,Â£43.70,images/f5b783f6cfdfe30895d912f9e337bb22.jpg
rip-it-up-and-start-again,Rip it Up and Start Again,,,Â£35.02,images/817f5089c0e6e62738dce2931e7323d3.jpg
kill-'em-and-leave:-searching-for-james-brown-and-the-american-soul,Kill 'Em and Leave: Searching for James Brown and the American Soul,,,Â£45.05,images/d48ee3fe30d6d9b9cc550b76dae5984a.jpg
"chronicles,-vol.-1","Chronicles, Vol. 1",,,Â£52.60,images/dfbd53a5c4bcb1bf676bf2a86335adbb.jpg
how-music-works,How Music Works,,,Â£37.32,images/1d4087ff0a63f09fae9cd8433d21c2c4.jpg
love-is-a-mix-tape-(music-#1),Love Is a Mix Tape (Music #1),,,Â£18.03,images/b2430e3958014d962042a14a912151ac.jpg
please-kill-me:-the-uncensored-oral-history-of-punk,Please Kill Me: The Uncensored Oral History of Punk,,,Â£31.19,images/8ebbba84c204b011527a8f4bd082b03f.jpg
"our-band-could-be-your-life:-scenes-from-the-american-indie-underground,-1981-1991","Our Band Could Be Your Life: Scenes from the American Indie Underground, 1981-1991",,,Â£57.25,images/ad96e9c9f1664cbcb0e9627b007fb6f9.jpg
this-is-your-brain-on-music:-the-science-of-a-human-obsession,This Is Your Brain on Music: The Science of a Human Obsession,,,Â£38.40,images/d8d3a16113069ccde25da34483a583fb.jpg
"orchestra-of-exiles:-the-story-of-bronislaw-huberman,-the-israel-philharmonic,-and-the-one-thousand-jews-he-saved-from-nazi-horrors","Orchestra of Exiles: The Story of Bronislaw Huberman, the Israel Philharmonic, and the One Thousand Jews He Saved from Nazi Horrors",,,Â£12.36,images/b59425287ce6b186715fa7b01054c2bf.jpg
life,Life,,,Â£31.58,images/9b6155b8013ed9e05ef8a85b4117165b.jpg
old-records-never-die:-one-man's-quest-for-his-vinyl-and-his-past,Old Records Never Die: One Man's Quest for His Vinyl and His Past,,,Â£55.66,images/aa55bbf7037a0e19ae69485adcc11903.jpg
no-one-here-gets-out-alive,No One Here Gets Out Alive,,,Â£20.02,images/8e9be254974e64a8a3d365a1571e3ec2.jpg
forever-rockers-(the-rocker-#12),Forever Rockers (The Rocker #12),,,Â£28.80,images/a2fc91793502f5c10b5826ad606de435.jpg
the-third-wave:-an-entrepreneurâs-vision-of-the-future,The Third Wave: An Entrepreneurâs Vision of the Future,,,Â£12.61,images/0f76b00ea914ced1822d8ac3480c485f.jpg
shoe-dog:-a-memoir-by-the-creator-of-nike,Shoe Dog: A Memoir by the Creator of NIKE,,,Â£23.99,images/fc21d144c7289e5b1cb133e01a925126.jpg
born-for-this:-how-to-find-the-work-you-were-meant-to-do,Born for This: How to Find the Work You Were Meant to Do,,,Â£21.59,images/9fe7f6432f216b166cb36f16130f20f6.jpg
the-10%-entrepreneur:-live-your-startup-dream-without-quitting-your-day-job,The 10% Entrepreneur: Live Your Startup Dream Without Quitting Your Day Job,,,Â£27.55,images/504b1891508614ff9393563f69d66c95.jpg
made-to-stick:-why-some-ideas-survive-and-others-die,Made to Stick: Why Some Ideas Survive and Others Die,,,Â£38.85,images/1e3e1572e17ade03b21c44617fbc4d68.jpg
the-dirty-little-secrets-of-getting-your-dream-job,The Dirty Little Secrets of Getting Your Dream Job,,,Â£33.34,images/e11bea016d0ae1d7e2dd46fb3cb870b7.jpg
the-art-of-startup-fundraising,The Art of Startup Fundraising,,,Â£21.00,images/67e81a7a82578a919a48816330836090.jpg
quench-your-own-thirst:-business-lessons-learned-over-a-beer-or-two,Quench Your Own Thirst: Business Lessons Learned Over a Beer or Two,,,Â£43.14,images/fe1afbd5caf79c3c957bfc5cf46f141e.jpg
the-e-myth-revisited:-why-most-small-businesses-don't-work-and-what-to-do-about-it,The E-Myth Revisited: Why Most Small Businesses Don't Work and What to Do About It,,,Â£36.91,images/a57ef7bdbaf704fca07ab6dd125b54f9.jpg
rework,Rework,,,Â£44.88,images/12233a9d0bf8187a988c27c6a54b3d31.jpg
"rich-dad,-poor-dad","Rich Dad, Poor Dad",,,Â£51.74,images/461cf454be3aac0b4cd066247c892679.jpg
the-lean-startup:-how-today's-entrepreneurs-use-continuous-innovation-to-create-radically-successful-businesses,The Lean Startup: How Today's Entrepreneurs Use Continuous Innovation to Create Radically Successful Businesses,,,Â£33.92,images/526e9f360da288db64ca70c89cdbcaa9.jpg
fifty-shades-freed-(fifty-shades-#3),Fifty Shades Freed (Fifty Shades #3),,,Â£15.36,images/f407d3bbf457d35701dfe72ee9ef3b68.jpg
the-murder-that-never-was-(forensic-instincts-#5),The Murder That Never Was (Forensic Instincts #5),,,Â£54.11,images/29e036acd8a6e3daa787ce2bc05bdbbb.jpg
soumission,Soumission,,,Â£50.10,images/eecfe998905e455df12064dba399c075.jpg
thirst,Thirst,,,Â£17.27,images/8c54a50576c204b80165a13545f73028.jpg
"we-love-you,-charlie-freeman","We Love You, Charlie Freeman",,,Â£50.27,images/87a2fddd7f6b240c0351e1eb950b6716.jpg
private-paris-(private-#10),Private Paris (Private #10),,,Â£47.61,images/0587ab519222a61f803fa4570c325ad2.jpg
the-vacationers,The Vacationers,,,Â£42.15,images/34c988a76c3cd7c04566d3030d8e7331.jpg
tuesday-nights-in-1980,Tuesday Nights in 1980,,,Â£21.04,images/a3ade5edecde67449329c1ebb016c049.jpg
the-regional-office-is-under-attack!,The Regional Office Is Under Attack!,,,Â£51.36,images/d473f01f077b91ce04e345305a3fa217.jpg
the-testament-of-mary,The Testament of Mary,,,Â£52.67,images/06a62270c0700ae3c537cf394cf145ee.jpg
finders-keepers-(bill-hodges-trilogy-#2),Finders Keepers (Bill Hodges Trilogy #2),,,Â£53.53,images/76804e1881b630a110794fef5aad02cf.jpg
take-me-with-you,Take Me with You,,,Â£45.21,images/bdad8933d15df7d7c6f3a16a9315048b.jpg
still-life-with-bread-crumbs,Still Life with Bread Crumbs,,,Â£26.41,images/a3ebe1ca5df0d3ff3e3d2b8fb8b2a551.jpg
shtum,Shtum,,,Â£55.84,images/63623a0b014b1f26e49aa61786e6e708.jpg
the-time-keeper,The Time Keeper,,,Â£27.88,images/37d108ff5b19028a52ddd73dba35d543.jpg
my-name-is-lucy-barton,My Name Is Lucy Barton,,,Â£41.56,images/28db43984c765a1d02fd3495f5c52eb6.jpg
the-first-hostage-(j.b.-collins-#2),The First Hostage (J.B. Collins #2),,,Â£25.85,images/813e1d11126330de52d9368e78d116cc.jpg
my-mrs.-brown,My Mrs. Brown,,,Â£24.48,images/2da3464fa2010bebedfba9eca77e42be.jpg
mr.-mercedes-(bill-hodges-trilogy-#1),Mr. Mercedes (Bill Hodges Trilogy #1),,,Â£28.90,images/657f9a3b7c0579c7fa499dddddd59422.jpg
i-am-pilgrim-(pilgrim-#1),I Am Pilgrim (Pilgrim #1),,,Â£10.60,images/8da36f821f35b795a3a420c84ca9737e.jpg
eligible-(the-austen-project-#4),Eligible (The Austen Project #4),,,Â£27.09,images/0a9a0b211bee87b544bd97a8320a0b73.jpg
